line id verse number,arabic text,english translation text
,,"Repeat the following 100 times or as many times as possible.
369"
,اَللَّهُمَّ ٱلْعَنْ اَوَّلَ ظَالِمٍ,"O Allah, withhold Your mercy from the foremost persecutor"
,ظَلَمَ حَقَّ مُحَمَّدٍ وَآلِ مُحَمَّدٍ,who usurped the right of Muhammad and Muhammad’s Household
,وَآخِرَ تَابِعٍ لَهُ عَلَىٰ ذٰلِكَ,and the last follower who acceded to his deed.
,اَللَّهُمَّ ٱلْعَنِ ٱلْعِصَابَةَ ٱلَّتِي جَاهَدَتِ ٱلْحُسَيْنَ,"O Allah, withhold Your mercy from the gang that struggled against Al-Husayn"
,وَشَايَعَتْ وَبَايَعَتْ وَتَابَعَتْ عَلَىٰ قَتْلِهِ,"and who supported each other against Him, paid homage to his enemies, and participated in slaying Him."
,اَللَّهُمَّ ٱلْعَنْهُمْ جَمِيعاً,"O Allah, withhold Your mercy from all of them."
