line id verse number,arabic text,english translation text
,,"Ziyarat of Syeda Fatima
Masooma e Qum (SA)"
,بِسْمِ اللَّهِ الرَّحْمَنِ الرَّحِيمِ,"In the Name of Allah, the
All-merciful, the
All-compassionate"
,اَللَّهُمَّ صَلِّ عَلَى مُحَمَّدٍوَ آلِ مُحَمَّد,"O Alláh bless
Muhammad and the family of Muhammad."
,السَّلاَمُ عَلَى آدَمَ صِفْوَةِ اللَّهِ السَّلاَمُ عَلَى نُوحٍ نَبِيِّ اللَّهِ‏,"Peace be on Adam, the Choice of Allah! Peace be on Noah, the Prophet of Allah,"
,السَّلاَمُ عَلَىإِبْرَاهِيمَ خَلِيلِ اللَّهِ‏,"Peace be on Ibraheem,
the Friend of Allah,"
,السَّلاَمُ عَلَى مُوسَى كَلِيمِ اللَّهِ,"Peace be on Mosa who spoke to Allah,"
,السَّلاَمُ عَلَى عِيسَى رُوحِ اللَّهِ‏,"Peace be on Isa,
the Spirit of Allah."
,السَّلاَمُ عَلَيْكَ يَا رَسُولَ اللَّهِ السَّلاَمُ عَلَيْكَ يَا خَيْرَ خَلْقِ اللَّهِ‏,"Peace be on you, O Messenger of Allah, Peace be on you, O the best of the Mankind"
,السَّلاَمُ عَلَيْكَ يَا صَفِيَّ اللَّهِ‏,"Peace be on you,
O Choice of Allah!"
,السَّلاَمُ عَلَيْكَ يَا مُحَمَّدَ بْنَ عَبْدِ اللَّهِ خَاتَمَ النَّبِيِّينَ‏,"Peace be on you. O Mohammed bin Abdullah, the last of the Prophets!"
,السَّلاَمُ عَلَيْكَ يَا أَمِيرَ الْمُؤْمِنِينَ عَلِيَّ بْنَ أَبِي طَالِبٍ وَصِيَّ رَسُولِ اللَّهِ‏,"Peace be on you, O Ali bin Abi Talib, Commander of the faithful and the Successor of the Messenger of Allah."
,السَّلاَمُ عَلَيْكِ يَا فَاطِمَةُ سَيِّدَةَ نِسَاءِ الْعَالَمِينَ‏,"Peace be on you,
O Fatimah, the Leader of
the women of the worlds,"
,السَّلاَمُ عَلَيْكُمَا يَا سِبْطَيْ نَبِيِّ الرَّحْمَةِ وَ سَيِّدَيْ شَبَابِ أَهْلِ الْجَنَّةِ,"Peace be on you, O the grandsons of the Prophet of Mercy, and the leaders of the youth of Paradise"
,السَّلاَمُ عَلَيْكَ يَا عَلِيَّ بْنَ الْحُسَيْنِ سَيِّدَ الْعَابِدِينَ وَ قُرَّةَ عَيْنِ النَّاظِرِينَ‏,"Peace be on you, O Ali bin Husain, the leader of worshippers, O Coolness of investigating eyes,"
,السَّلاَمُ عَلَيْكَ يَا مُحَمَّدَ بْنَ عَلِيٍّ بَاقِرَ الْعِلْمِ بَعْدَ النَّبِيِ‏,"Peace be on you, O Mohammed bin Ali, O the explorer of the knowledge"
,السَّلاَمُ عَلَيْكَ يَا جَعْفَرَ بْنَ مُحَمَّدٍ الصَّادِقَ الْبَارَّ الْأَمِينَ‏,"Peace be on you, O Jafar bin Mohammed, the truthful the benign, the trustworthy,"
,السَّلاَمُ عَلَيْكَ يَا مُوسَى بْنَ جَعْفَرٍ الطَّاهِرَ الطُّهْرَ,"Peace be on you, O Mosa bin Jafar, the pure, the purified,"
,السَّلاَمُ عَلَيْكَ يَا عَلِيَّ بْنَ مُوسَى الرِّضَا الْمُرْتَضَى‏,"Peace be on you, O Ali bin Mosa, the pleased, the gratified,"
,السَّلاَمُ عَلَيْكَ يَا مُحَمَّدَ بْنَ عَلِيٍّ التَّقِيَّ‏,"Peace be on you, O Mohammed bin Ali, the pious one"
,السَّلاَمُ عَلَيْكَ يَا عَلِيَّ بْنَ مُحَمَّدٍ النَّقِيَّ النَّاصِحَ الْأَمِينَ‏,"Peace be on you, O Ali bin Mohammed, the pure, the advising guardian, and the trustworthy"
,السَّلاَمُ عَلَيْكَ يَا حَسَنَ بْنَ عَلِيٍّ ‏,"Peace be on Hasan bin Ali,"
,السَّلاَمُ عَلَى الْوَصِيِّ مِنْ بَعْدِهِ‏,Peace be on the successor after him
,اللَّهُمَّ صَلِّ عَلَى نُورِكَ وَ سِرَاجِكَ وَ وَلِيِّ وَلِيِّكَ وَ وَصِيِّ وَصِيِّكَ وَ حُجَّتِكَ عَلَى خَلْقِكَ‏,"O Allah, bless your light, the successor and vicegerent of Thy Messenger and Thy decisive argument over mankind"
,السَّلاَمُ عَلَيْكِ يَا بِنْتَ رَسُولِ اللَّهِ السَّلاَمُ عَلَيْكِ يَا بِنْتَ فَاطِمَةَ وَ خَدِيجَةَ,"Peace be on you, O daughter of the Messenger of Allah! Peace be on you, O, daughter of Fatimah and Khadeejah!"
,السَّلاَمُ عَلَيْكِ يَا بِنْتَ أَمِيرِ الْمُؤْمِنِينَ السَّلاَمُ عَلَيْكِ يَا بِنْتَ الْحَسَنِ وَ الْحُسَيْنِ‏,"Peace be on you, O, daughter of the Commander of the faithful! Peace be on you, O, daughter of Hasan and Husain!"
,السَّلاَمُ عَلَيْكِ يَا بِنْتَ وَلِيِّ اللَّهِ السَّلاَمُ عَلَيْكِ يَا أُخْتَ وَلِيِّ اللَّهِ السَّلاَمُ عَلَيْكِ يَا عَمَّةَ وَلِيِّ اللَّهِ‏,"Peace be on you, O, daughter of the vicegerent of Allah! Peace be on you, O, sister of the vicegerent of Allah! Peace be on you, O, Aunt of the vicegerent of Allah!"
,السَّلاَمُ عَلَيْكِ يَا بِنْتَ مُوسَى بْنِ جَعْفَرٍ وَ رَحْمَةُ اللَّهِ وَ بَرَكَاتُهُ‏,"Peace be on you, O, daughter of Mosa bin Jafar! May Allah confer His Mercy and blessing on you!"
,السَّلاَمُ عَلَيْكِ عَرَّفَ اللَّهُ بَيْنَنَا وَ بَيْنَكُمْ فِي الْجَنَّةِ,Peace be on you May Allah grant us your companionship on the day of Judgment
,وَ حَشَرَنَا فِي زُمْرَتِكُمْ وَ أَوْرَدَنَا حَوْضَ نَبِيِّكُمْ وَ سَقَانَا بِكَأْسِ جَدِّكُمْ مِنْ يَدِ عَلِيِّ بْنِ أَبِي طَالِبٍ‏,"and guide us to follow your footsteps and lead us to your grandfather's fountain andquench our thirst out of it, with Mohammed's own cup in Ali's hand,"
,صَلَوَاتُ اللَّهِ عَلَيْكُمْ أَسْأَلُ اللَّهَ أَنْ يُرِيَنَا فِيكُمُ السُّرُورَ وَ الْفَرَجَ‏,"Allah bless you All. I ask Allah to grant us, through you, happiness, ease and your companionship,"
,وَ أَنْ يَجْمَعَنَا وَ إِيَّاكُمْ فِي زُمْرَةِ جَدِّكُمْ مُحَمَّدٍ صَلَّى اللَّهُ عَلَيْهِ وَ آلِهِ‏,together with your grandfather on the day of Judgment
,وَ أَنْ لاَ يَسْلُبَنَا مَعْرِفَتَكُمْ إِنَّهُ وَلِيٌّ قَدِيرٌ,"and not to deprive us from understanding you. Indeed, He is Protector and Powerful on everything."
,أَتَقَرَّبُ إِلَى اللَّهِ بِحُبِّكُمْ وَ الْبَرَاءَةِ مِنْ أَعْدَائِكُمْ وَ التَّسْلِيمِ إِلَى اللَّهِ رَاضِياً بِهِ غَيْرَ مُنْكِرٍ وَ لاَ مُسْتَكْبِرٍ,"O Allah, I seek Thy nearness through my love for you, my enmity for your enemies and my surrender to Allah willingly, not arrogantly my acceptance,"
,وَ عَلَى يَقِينِ مَا أَتَى بِهِ مُحَمَّدٌ وَ بِهِ رَاضٍ نَطْلُبُ بِذَلِكَ وَجْهَكَ يَا سَيِّدِي اللَّهُمَّ وَ رِضَاكَ وَ الدَّارَ الْآخِرَةِ,"with unshaken faith, what He communicated to Mohammed seeking in that Thy Face! Thy satisfaction, and the next world."
,يَا فَاطِمَةُ اشْفَعِي لِي فِي الْجَنَّةِ فَإِنَّ لَكِ عِنْدَ اللَّهِ شَأْناً مِنَ الشَّأْنِ‏,"O Master! Stand by us when Allah sits in judgment over us, O intimate of Allah,"
,اللَّهُمَّ إِنِّي أَسْأَلُكَ أَنْ تَخْتِمَ لِي بِالسَّعَادَةِ فَلاَ تَسْلُبْ مِنِّي مَا أَنَا فِيهِ‏,"O Allah, I ask Thee to make my ending happy, and not to take away what you have given me"
,وَ لاَ حَوْلَ وَ لاَ قُوَّةَ إِلاَّ بِاللَّهِ الْعَلِيِّ الْعَظِيمِ‏,"There is neither might nor power but with Allah, the Great, the Exalted."
,اللَّهُمَّ اسْتَجِبْ لَنَا وَ تَقَبَّلْهُ بِكَرَمِكَ وَ عِزَّتِكَ وَ بِرَحْمَتِكَ وَ عَافِيَتِكَ‏,"So by Thy generosity, might Mercy and bounteousness, comply with our supplication,"
,وَ صَلَّى اللَّهُ عَلَى مُحَمَّدٍ وَ آلِهِ أَجْمَعِينَ وَ سَلَّمَ تَسْلِيماً يَا أَرْحَمَ الرَّاحِمِين,"Allah, bless Mohammed, and his pious and pure Progeny and give them abundant peace! O the most Merciful of the Merciful."
