[4:108],يَسْتَخْفُونَ مِنَ النَّاسِ وَلَا يَسْتَخْفُونَ مِنَ اللَّهِ وَهُوَ مَعَهُمْ إِذْ يُبَيِّتُونَ مَا لَا يَرْضَىٰ مِنَ الْقَوْلِ ۚ وَكَانَ اللَّهُ بِمَا يَعْمَلُونَ مُحِيطًا,"They try to hide [their real character] from people, but they do not try to hide from Allah, though He is with them when they conspire overnight with a discourse that He does not approve of. And Allah comprehends whatever they do."
[4:109],هَا أَنتُمْ هَٰؤُلَاءِ جَادَلْتُمْ عَنْهُمْ فِي الْحَيَاةِ الدُّنْيَا فَمَن يُجَادِلُ اللَّهَ عَنْهُمْ يَوْمَ الْقِيَامَةِ أَم مَّن يَكُونُ عَلَيْهِمْ وَكِيلًا,"Aha! There you are, pleading for them in the life of this world! But who will plead for them with Allah on the Day of Resurrection, or will be their defender?"
[4:110],وَمَن يَعْمَلْ سُوءًا أَوْ يَظْلِمْ نَفْسَهُ ثُمَّ يَسْتَغْفِرِ اللَّهَ يَجِدِ اللَّهَ غَفُورًا رَّحِيمًا,"Whoever commits evil or wrongs himself and then pleads to Allah for forgiveness, will find Allah all-forgiving, all-merciful."
[4:111],وَمَن يَكْسِبْ إِثْمًا فَإِنَّمَا يَكْسِبُهُ عَلَىٰ نَفْسِهِ ۚ وَكَانَ اللَّهُ عَلِيمًا حَكِيمًا,"Whoever commits a sin, commits it only against himself; and Allah is all-knowing, all-wise."
[4:112],وَمَن يَكْسِبْ خَطِيئَةً أَوْ إِثْمًا ثُمَّ يَرْمِ بِهِ بَرِيئًا فَقَدِ احْتَمَلَ بُهْتَانًا وَإِثْمًا مُّبِينًا,"But someone who commits an iniquity or sin and then accuses an innocent person of it, is indeed guilty of calumny and a flagrant sin."
[4:113],وَلَوْلَا فَضْلُ اللَّهِ عَلَيْكَ وَرَحْمَتُهُ لَهَمَّت طَّائِفَةٌ مِّنْهُمْ أَن يُضِلُّوكَ وَمَا يُضِلُّونَ إِلَّا أَنفُسَهُمْ ۖ وَمَا يَضُرُّونَكَ مِن شَيْءٍ ۚ,"Were it not for Allah’s grace and His mercy on you, a group of them were bent on leading you astray; but they do not mislead anyone except themselves, and they cannot do you any harm."
[4:113],وَأَنزَلَ اللَّهُ عَلَيْكَ الْكِتَابَ وَالْحِكْمَةَ وَعَلَّمَكَ مَا لَمْ تَكُن تَعْلَمُ ۚ وَكَانَ فَضْلُ اللَّهِ عَلَيْكَ عَظِيمًا,"Allah has sent down to you the Book and wisdom, and He has taught you what you did not know, and great is Allah’s grace upon you."
[4:114],لَّا خَيْرَ فِي كَثِيرٍ مِّن نَّجْوَاهُمْ إِلَّا مَنْ أَمَرَ بِصَدَقَةٍ أَوْ مَعْرُوفٍ أَوْ إِصْلَاحٍ بَيْنَ النَّاسِ ۚ وَمَن يَفْعَلْ ذَٰلِكَ ابْتِغَاءَ مَرْضَاتِ اللَّهِ فَسَوْفَ نُؤْتِيهِ أَجْرًا عَظِيمًا,"There is no good in much of their secret talks, excepting him who enjoins charity or what is right or reconciliation between people, and whoever does that, seeking Allah’s pleasure, soon We shall give him a great reward."
[4:115],وَمَن يُشَاقِقِ الرَّسُولَ مِن بَعْدِ مَا تَبَيَّنَ لَهُ الْهُدَىٰ وَيَتَّبِعْ غَيْرَ سَبِيلِ الْمُؤْمِنِينَ نُوَلِّهِ مَا تَوَلَّىٰ وَنُصْلِهِ جَهَنَّمَ ۖ وَسَاءَتْ مَصِيرًا,"Whoever defies the Apostle, after the guidance has become manifest to him, and follows a way other than that of the faithful, We shall abandon him to his devices and We shall make him enter hell, and it is an evil destination."
[4:116],إِنَّ اللَّهَ لَا يَغْفِرُ أَن يُشْرَكَ بِهِ وَيَغْفِرُ مَا دُونَ ذَٰلِكَ لِمَن يَشَاءُ ۚ وَمَن يُشْرِكْ بِاللَّهِ فَقَدْ ضَلَّ ضَلَالًا بَعِيدًا,"Indeed Allah does not forgive that any partner should be ascribed to Him, but He forgives anything besides that to whomever He wishes. And whoever ascribes partners to Allah has certainly strayed into far error."
[4:117],إِن يَدْعُونَ مِن دُونِهِ إِلَّا إِنَاثًا وَإِن يَدْعُونَ إِلَّا شَيْطَانًا مَّرِيدًا,"They invoke none but females besides Him, and invoke none but a froward Satan,"
[4:118],لَّعَنَهُ اللَّهُ ۘ وَقَالَ لَأَتَّخِذَنَّ مِنْ عِبَادِكَ نَصِيبًا مَّفْرُوضًا,"whom Allah has cursed, and who said, ‘I will surely take of Your servants a settled share,"
[4:119],وَلَأُضِلَّنَّهُمْ وَلَأُمَنِّيَنَّهُمْ وَلَآمُرَنَّهُمْ فَلَيُبَتِّكُنَّ آذَانَ الْأَنْعَامِ وَلَآمُرَنَّهُمْ فَلَيُغَيِّرُنَّ خَلْقَ اللَّهِ ۚ وَمَن يَتَّخِذِ الشَّيْطَانَ وَلِيًّا مِّن دُونِ اللَّهِ فَقَدْ خَسِرَ خُسْرَانًا مُّبِينًا,"and I will lead them astray and give them [false] hopes, and prompt them to slit the ears of cattle, and I will prompt them to alter Allah’s creation.’ Whoever takes Satan as a guardian instead of Allah has certainly incurred a manifest loss."
[4:120],يَعِدُهُمْ وَيُمَنِّيهِمْ ۖ وَمَا يَعِدُهُمُ الشَّيْطَانُ إِلَّا غُرُورًا,"He makes them promises and gives them [false] hopes, yet Satan does not promise them anything but delusion."
[4:121],أُولَٰئِكَ مَأْوَاهُمْ جَهَنَّمُ وَلَا يَجِدُونَ عَنْهَا مَحِيصًا,"The refuge of such shall be hell, and they will not find any escape from it."
[4:122],وَالَّذِينَ آمَنُوا وَعَمِلُوا الصَّالِحَاتِ سَنُدْخِلُهُمْ جَنَّاتٍ تَجْرِي مِن تَحْتِهَا الْأَنْهَارُ خَالِدِينَ فِيهَا أَبَدًا ۖ وَعْدَ اللَّهِ حَقًّا ۚ وَمَنْ أَصْدَقُ مِنَ اللَّهِ قِيلًا,"But those who have faith and do righteous deeds, We will admit them into gardens with streams running in them, to remain in them forever—a true promise of Allah, and who is truer in speech than Allah?"
[4:123],لَّيْسَ بِأَمَانِيِّكُمْ وَلَا أَمَانِيِّ أَهْلِ الْكِتَابِ ۗ مَن يَعْمَلْ سُوءًا يُجْزَ بِهِ وَلَا يَجِدْ لَهُ مِن دُونِ اللَّهِ وَلِيًّا وَلَا نَصِيرًا,"It will be neither after your hopes nor the hopes of the People of the Book: whoever commits evil shall be requited for it, and he will not find for himself any guardian or helper besides Allah."
[4:124],وَمَن يَعْمَلْ مِنَ الصَّالِحَاتِ مِن ذَكَرٍ أَوْ أُنثَىٰ وَهُوَ مُؤْمِنٌ فَأُولَٰئِكَ يَدْخُلُونَ الْجَنَّةَ وَلَا يُظْلَمُونَ نَقِيرًا,"And whoever does righteous deeds, whether male or female, should he be faithful—such shall enter paradise and they will not be wronged [so much as] the speck on a date-stone."
[4:125],وَمَنْ أَحْسَنُ دِينًا مِّمَّنْ أَسْلَمَ وَجْهَهُ لِلَّهِ وَهُوَ مُحْسِنٌ وَاتَّبَعَ مِلَّةَ إِبْرَاهِيمَ حَنِيفًا ۗ وَاتَّخَذَ اللَّهُ إِبْرَاهِيمَ خَلِيلًا,"Who has a better religion than him who submits his will to Allah, being virtuous, and follows the creed of Abraham, a Hanif? And Allah took Abraham for a dedicated friend."
[4:126],وَلِلَّهِ مَا فِي السَّمَاوَاتِ وَمَا فِي الْأَرْضِ ۚ وَكَانَ اللَّهُ بِكُلِّ شَيْءٍ مُّحِيطًا,"To Allah belongs whatever is in the heavens and whatever is on the earth, and Allah comprehends all things."
[4:127],وَيَسْتَفْتُونَكَ فِي النِّسَاءِ ۖ قُلِ اللَّهُ يُفْتِيكُمْ فِيهِنَّ وَمَا يُتْلَىٰ عَلَيْكُمْ فِي الْكِتَابِ فِي يَتَامَى النِّسَاءِ اللَّاتِي لَا تُؤْتُونَهُنَّ مَا كُتِبَ لَهُنَّ وَتَرْغَبُونَ أَن تَنكِحُوهُنَّ وَالْمُسْتَضْعَفِينَ مِنَ الْوِلْدَانِ,"They seek your ruling concerning women. Say, ‘Allah gives you a ruling concerning them and what is announced to you in the Book concerning girl orphans—whom you do not give what has been prescribed for them, and yet you desire to marry them—and about the weak among children:"
[4:127],وَأَن تَقُومُوا لِلْيَتَامَىٰ بِالْقِسْطِ ۚ وَمَا تَفْعَلُوا مِنْ خَيْرٍ فَإِنَّ اللَّهَ كَانَ بِهِ عَلِيمًا,"that you should maintain the orphans with justice, and whatever good you do, indeed Allah knows it well."
[4:128],وَإِنِ امْرَأَةٌ خَافَتْ مِن بَعْلِهَا نُشُوزًا أَوْ إِعْرَاضًا فَلَا جُنَاحَ عَلَيْهِمَا أَن يُصْلِحَا بَيْنَهُمَا صُلْحًا ۚ وَالصُّلْحُ خَيْرٌ ۗ وَأُحْضِرَتِ الْأَنفُسُ الشُّحَّ ۚ وَإِن تُحْسِنُوا وَتَتَّقُوا فَإِنَّ اللَّهَ كَانَ بِمَا تَعْمَلُونَ خَبِيرًا,"If a woman fears from her husband misconduct or desertion, there is no sin upon the couple if they reach a reconciliation between themselves; and reconcilement is better. The souls are prone to greed; but if you are virtuous and Godwary, Allah is indeed well aware of what you do."
[4:129],وَلَن تَسْتَطِيعُوا أَن تَعْدِلُوا بَيْنَ النِّسَاءِ وَلَوْ حَرَصْتُمْ ۖ فَلَا تَمِيلُوا كُلَّ الْمَيْلِ فَتَذَرُوهَا كَالْمُعَلَّقَةِ ۚ وَإِن تُصْلِحُوا وَتَتَّقُوا فَإِنَّ اللَّهَ كَانَ غَفُورًا رَّحِيمًا,"You will not be able to be fair between wives, even if you are eager to do so. Yet do not turn away from one altogether, leaving her as if in a suspense. But if you are conciliatory and Godwary, Allah is indeed all-forgiving, all-merciful."
[4:130],وَإِن يَتَفَرَّقَا يُغْنِ اللَّهُ كُلًّا مِّن سَعَتِهِ ۚ وَكَانَ اللَّهُ وَاسِعًا حَكِيمًا,"But if they separate, Allah will suffice each of them out of His bounty, and Allah is all-bounteous, all-wise."
[4:131],وَلِلَّهِ مَا فِي السَّمَاوَاتِ وَمَا فِي الْأَرْضِ ۗ وَلَقَدْ وَصَّيْنَا الَّذِينَ أُوتُوا الْكِتَابَ مِن قَبْلِكُمْ وَإِيَّاكُمْ أَنِ اتَّقُوا اللَّهَ ۚ,"To Allah belongs whatever is in the heavens and whatever is on the earth. We have certainly enjoined those who were given the Book before you, and you, that you should be wary of Allah."
[4:131],وَإِن تَكْفُرُوا فَإِنَّ لِلَّهِ مَا فِي السَّمَاوَاتِ وَمَا فِي الْأَرْضِ ۚ وَكَانَ اللَّهُ غَنِيًّا حَمِيدًا,"But if you are faithless, [you should know that] to Allah indeed belongs whatever is in the heavens and whatever is on the earth, and Allah is all-sufficient, all-laudable."
[4:132],وَلِلَّهِ مَا فِي السَّمَاوَاتِ وَمَا فِي الْأَرْضِ ۚ وَكَفَىٰ بِاللَّهِ وَكِيلًا,"To Allah belongs whatever is in the heavens and whatever is on the earth, and Allah suffices as trustee."
[4:133],إِن يَشَأْ يُذْهِبْكُمْ أَيُّهَا النَّاسُ وَيَأْتِ بِآخَرِينَ ۚ وَكَانَ اللَّهُ عَلَىٰ ذَٰلِكَ قَدِيرًا,"If He wishes, He will take you away, O mankind, and bring others [in your place]; Allah has the power to do that."
[4:134],مَّن كَانَ يُرِيدُ ثَوَابَ الدُّنْيَا فَعِندَ اللَّهِ ثَوَابُ الدُّنْيَا وَالْآخِرَةِ ۚ وَكَانَ اللَّهُ سَمِيعًا بَصِيرًا,"Whoever desires the reward of this world, [should know that] with Allah is the reward of this world and the Hereafter, and Allah is all-hearing, all-seeing."
[4:135],يَا أَيُّهَا الَّذِينَ آمَنُوا كُونُوا قَوَّامِينَ بِالْقِسْطِ شُهَدَاءَ لِلَّهِ وَلَوْ عَلَىٰ أَنفُسِكُمْ أَوِ الْوَالِدَيْنِ وَالْأَقْرَبِينَ ۚ إِن يَكُنْ غَنِيًّا أَوْ فَقِيرًا فَاللَّهُ أَوْلَىٰ بِهِمَا ۖ,"O you who have faith! Be maintainers of justice and witnesses for the sake of Allah, even if it should be against yourselves or [your] parents and near relatives, and whether it be [someone] rich or poor, for Allah has a greater right over them."
[4:135],فَلَا تَتَّبِعُوا الْهَوَىٰ أَن تَعْدِلُوا ۚ وَإِن تَلْوُوا أَوْ تُعْرِضُوا فَإِنَّ اللَّهَ كَانَ بِمَا تَعْمَلُونَ خَبِيرًا,"So do not follow [your] desires, lest you should be unfair, and if you distort [the testimony] or disregard [it], Allah is indeed well aware of what you do."
[4:136],يَا أَيُّهَا الَّذِينَ آمَنُوا آمِنُوا بِاللَّهِ وَرَسُولِهِ وَالْكِتَابِ الَّذِي نَزَّلَ عَلَىٰ رَسُولِهِ وَالْكِتَابِ الَّذِي أَنزَلَ مِن قَبْلُ ۚ,O you who have faith! Have faith in Allah and His Apostle and the Book that He has sent down to His Apostle and the Book He had sent down earlier.
[4:136],وَمَن يَكْفُرْ بِاللَّهِ وَمَلَائِكَتِهِ وَكُتُبِهِ وَرُسُلِهِ وَالْيَوْمِ الْآخِرِ فَقَدْ ضَلَّ ضَلَالًا بَعِيدًا,"Whoever disbelieves in Allah and His angels, His Books and His apostles and the Last Day, has certainly strayed into far error."
[4:137],إِنَّ الَّذِينَ آمَنُوا ثُمَّ كَفَرُوا ثُمَّ آمَنُوا ثُمَّ كَفَرُوا ثُمَّ ازْدَادُوا كُفْرًا لَّمْ يَكُنِ اللَّهُ لِيَغْفِرَ لَهُمْ وَلَا لِيَهْدِيَهُمْ سَبِيلًا,"As for those who believe and then disbelieve, then believe [again] and then disbelieve and then increase in disbelief, Allah shall never forgive them, nor shall He guide them to any way."
[4:138],بَشِّرِ الْمُنَافِقِينَ بِأَنَّ لَهُمْ عَذَابًا أَلِيمًا,Inform the hypocrites that there is a painful punishment for them
[4:139],الَّذِينَ يَتَّخِذُونَ الْكَافِرِينَ أَوْلِيَاءَ مِن دُونِ الْمُؤْمِنِينَ ۚ أَيَبْتَغُونَ عِندَهُمُ الْعِزَّةَ فَإِنَّ الْعِزَّةَ لِلَّهِ جَمِيعًا,"—those who take the faithless for allies instead of the faithful. Do they seek honour with them? [If so,] indeed all honour belongs to Allah."
[4:140],وَقَدْ نَزَّلَ عَلَيْكُمْ فِي الْكِتَابِ أَنْ إِذَا سَمِعْتُمْ آيَاتِ اللَّهِ يُكْفَرُ بِهَا وَيُسْتَهْزَأُ بِهَا فَلَا تَقْعُدُوا مَعَهُمْ حَتَّىٰ يَخُوضُوا فِي حَدِيثٍ غَيْرِهِ ۚ إِنَّكُمْ إِذًا مِّثْلُهُمْ ۗ إِنَّ اللَّهَ جَامِعُ الْمُنَافِقِينَ وَالْكَافِرِينَ فِي جَهَنَّمَ جَمِيعًا,"Certainly He has sent down to you in the Book that when you hear Allah’s signs being disbelieved and derided, do not sit with them until they engage in some other discourse, or else you [too] will be like them. Indeed Allah will gather the hypocrites and the faithless in hell all together"
[4:141],الَّذِينَ يَتَرَبَّصُونَ بِكُمْ فَإِن كَانَ لَكُمْ فَتْحٌ مِّنَ اللَّهِ قَالُوا أَلَمْ نَكُن مَّعَكُمْ وَإِن كَانَ لِلْكَافِرِينَ نَصِيبٌ قَالُوا أَلَمْ نَسْتَحْوِذْ عَلَيْكُمْ وَنَمْنَعْكُم مِّنَ الْمُؤْمِنِينَ ۚ,"—those who lie in wait for you: if there is a victory for you from Allah, they say, ‘Were we not with you?’ But if the faithless get a share [of victory], they say, ‘Did we not prevail upon you and defend you against the faithful?’"
[4:141],فَاللَّهُ يَحْكُمُ بَيْنَكُمْ يَوْمَ الْقِيَامَةِ ۗ وَلَن يَجْعَلَ اللَّهُ لِلْكَافِرِينَ عَلَى الْمُؤْمِنِينَ سَبِيلًا,"Allah will judge between you on the Day of Resurrection, and Allah will never provide the faithless any way [to prevail] over the faithful."
[4:142],إِنَّ الْمُنَافِقِينَ يُخَادِعُونَ اللَّهَ وَهُوَ خَادِعُهُمْ وَإِذَا قَامُوا إِلَى الصَّلَاةِ قَامُوا كُسَالَىٰ يُرَاءُونَ النَّاسَ وَلَا يَذْكُرُونَ اللَّهَ إِلَّا قَلِيلًا,"The hypocrites indeed seek to deceive Allah, but it is He who outwits them. When they stand up for prayer, they stand up lazily, showing off to the people and not remembering Allah except a little,"
[4:143],مُّذَبْذَبِينَ بَيْنَ ذَٰلِكَ لَا إِلَىٰ هَٰؤُلَاءِ وَلَا إِلَىٰ هَٰؤُلَاءِ ۚ وَمَن يُضْلِلِ اللَّهُ فَلَن تَجِدَ لَهُ سَبِيلًا,"wavering in between: neither with these, nor with those. And whomever Allah leads astray, you will never find any way for him."
[4:144],يَا أَيُّهَا الَّذِينَ آمَنُوا لَا تَتَّخِذُوا الْكَافِرِينَ أَوْلِيَاءَ مِن دُونِ الْمُؤْمِنِينَ ۚ أَتُرِيدُونَ أَن تَجْعَلُوا لِلَّهِ عَلَيْكُمْ سُلْطَانًا مُّبِينًا,O you who have faith! Do not take the faithless for friends instead of the faithful. Do you wish to give Allah a clear sanction against yourselves?
[4:145],إِنَّ الْمُنَافِقِينَ فِي الدَّرْكِ الْأَسْفَلِ مِنَ النَّارِ وَلَن تَجِدَ لَهُمْ نَصِيرًا,"Indeed the hypocrites will be in the lowest reach of the Fire, and you will never find any helper for them,"
[4:146],إِلَّا الَّذِينَ تَابُوا وَأَصْلَحُوا وَاعْتَصَمُوا بِاللَّهِ وَأَخْلَصُوا دِينَهُمْ لِلَّهِ فَأُولَٰئِكَ مَعَ الْمُؤْمِنِينَ ۖ وَسَوْفَ يُؤْتِ اللَّهُ الْمُؤْمِنِينَ أَجْرًا عَظِيمًا,"except for those who repent and reform, and hold fast to Allah and dedicate their religion [exclusively] to Allah. Those are with the faithful, and soon Allah will give the faithful a great reward."
[4:147],مَّا يَفْعَلُ اللَّهُ بِعَذَابِكُمْ إِن شَكَرْتُمْ وَآمَنتُمْ ۚ وَكَانَ اللَّهُ شَاكِرًا عَلِيمًا,"Why should Allah punish you if you give thanks and be faithful? And Allah is appreciative, all-knowing."
