line id verse number,arabic text,english translation text
,بِسْمِ اللَّهِ الرَّحْمَٰنِ الرَّحِيمِ,"In the Name of Allah, the All-beneficent, the All-merciful."
[4:24],وَالْمُحْصَنَاتُ مِنَ النِّسَاءِ إِلَّا مَا مَلَكَتْ أَيْمَانُكُمْ ۖ كِتَابَ اللَّهِ عَلَيْكُمْ ۚ وَأُحِلَّ لَكُم مَّا وَرَاءَ ذَٰلِكُمْ أَن تَبْتَغُوا بِأَمْوَالِكُم مُّحْصِنِينَ غَيْرَ مُسَافِحِينَ ۚ,"and married women, excepting your slave-women. This is Allah’s ordinance for you. As to others than these, it is lawful for you to seek [temporary union with them] with your wealth, in wedlock, not in license."
[4:24],فَمَا اسْتَمْتَعْتُم بِهِ مِنْهُنَّ فَآتُوهُنَّ أُجُورَهُنَّ فَرِيضَةً ۚ وَلَا جُنَاحَ عَلَيْكُمْ فِيمَا تَرَاضَيْتُم بِهِ مِن بَعْدِ الْفَرِيضَةِ ۚ إِنَّ اللَّهَ كَانَ عَلِيمًا حَكِيمًا,"For the enjoyment you have had from them thereby, give them their dowries, by way of settlement, and there is no sin upon you in what you may agree upon after the settlement. Indeed Allah is all-knowing, all-wise."
[4:25],وَمَن لَّمْ يَسْتَطِعْ مِنكُمْ طَوْلًا أَن يَنكِحَ الْمُحْصَنَاتِ الْمُؤْمِنَاتِ فَمِن مَّا مَلَكَتْ أَيْمَانُكُم مِّن فَتَيَاتِكُمُ الْمُؤْمِنَاتِ ۚ,"As for those of you who cannot afford to marry faithful free women, then [let them marry] from what you own, from among your faithful slave-women."
[4:25],ووَاللَّهُ أَعْلَمُ بِإِيمَانِكُم ۚ بَعْضُكُم مِّن بَعْضٍ ۚ فَانكِحُوهُنَّ بِإِذْنِ أَهْلِهِنَّ وَآتُوهُنَّ أُجُورَهُنَّ بِالْمَعْرُوفِ مُحْصَنَاتٍ غَيْرَ مُسَافِحَاتٍ وَلَا مُتَّخِذَاتِ أَخْدَانٍ ۚ,"Your faith is best known [only] to Allah; you are all [on a] similar [footing]. So marry them with their masters’ permission, and give them their dowries in an honourable manner—[such of them] as are chaste women, not licentious ones or those who take paramours."
[4:25],وفَإِذَا أُحْصِنَّ فَإِنْ أَتَيْنَ بِفَاحِشَةٍ فَعَلَيْهِنَّ نِصْفُ مَا عَلَى الْمُحْصَنَاتِ مِنَ الْعَذَابِ ۚ ذَٰلِكَ لِمَنْ خَشِيَ الْعَنَتَ مِنكُمْ ۚ وَأَن تَصْبِرُوا خَيْرٌ لَّكُمْ ۗ وَاللَّهُ غَفُورٌ رَّحِيمٌ,"But should they commit an indecent act on marrying, there shall be for them [only] half the punishment for free women. This is for those of you who fear falling into fornication; but it is better that you be continent, and Allah is all-forgiving, all-merciful."
[4:26],يُرِيدُ اللَّهُ لِيُبَيِّنَ لَكُمْ وَيَهْدِيَكُمْ سُنَنَ الَّذِينَ مِن قَبْلِكُمْ وَيَتُوبَ عَلَيْكُمْ ۗ وَاللَّهُ عَلِيمٌ حَكِيمٌ,"Allah desires to explain [the laws] to you, and to guide you to the customs of those who were before you, and to turn toward you clemently, and Allah is all-knowing, all-wise."
[4:27],وَاللَّهُ يُرِيدُ أَن يَتُوبَ عَلَيْكُمْ وَيُرِيدُ الَّذِينَ يَتَّبِعُونَ الشَّهَوَاتِ أَن تَمِيلُوا مَيْلًا عَظِيمًا,"Allah desires to turn toward you clemently, but those who pursue their [base] appetites desire that you fall into gross waywardness."
[4:28],يُرِيدُ اللَّهُ أَن يُخَفِّفَ عَنكُمْ ۚ وَخُلِقَ الْإِنسَانُ ضَعِيفًا,"Allah desires to lighten your burden, for man was created weak."
[4:29],يَا أَيُّهَا الَّذِينَ آمَنُوا لَا تَأْكُلُوا أَمْوَالَكُم بَيْنَكُم بِالْبَاطِلِ إِلَّا أَن تَكُونَ تِجَارَةً عَن تَرَاضٍ مِّنكُمْ ۚ وَلَا تَقْتُلُوا أَنفُسَكُمْ ۚ إِنَّ اللَّهَ كَانَ بِكُمْ رَحِيمًا,"O you who have faith! Do not eat up your wealth among yourselves unrightfully, but it should be trade by mutual consent. And do not kill yourselves. Indeed Allah is most merciful to you."
[4:30],وَمَن يَفْعَلْ ذَٰلِكَ عُدْوَانًا وَظُلْمًا فَسَوْفَ نُصْلِيهِ نَارًا ۚ وَكَانَ ذَٰلِكَ عَلَى اللَّهِ يَسِيرًا,"And whoever does that in aggression and injustice, We will soon make him enter the Fire, and that is easy for Allah."
[4:31],إِن تَجْتَنِبُوا كَبَائِرَ مَا تُنْهَوْنَ عَنْهُ نُكَفِّرْ عَنكُمْ سَيِّئَاتِكُمْ وَنُدْخِلْكُم مُّدْخَلًا كَرِيمًا,"If you avoid the major sins that you are forbidden, We will absolve you of your misdeeds and admit you to a noble abode."
[4:32],وَلَا تَتَمَنَّوْا مَا فَضَّلَ اللَّهُ بِهِ بَعْضَكُمْ عَلَىٰ بَعْضٍ ۚ لِّلرِّجَالِ نَصِيبٌ مِّمَّا اكْتَسَبُوا ۖ وَلِلنِّسَاءِ نَصِيبٌ مِّمَّا اكْتَسَبْنَ ۚ وَاسْأَلُوا اللَّهَ مِن فَضْلِهِ ۗ إِنَّ اللَّهَ كَانَ بِكُلِّ شَيْءٍ عَلِيمًا,"Do not covet the advantage, which Allah has given some of you over others. To men belongs a share of what they have earned, and to women a share of what they have earned. And ask Allah for His bounty. Indeed Allah has knowledge of all things."
[4:33],وَلِكُلٍّ جَعَلْنَا مَوَالِيَ مِمَّا تَرَكَ الْوَالِدَانِ وَالْأَقْرَبُونَ ۚ وَالَّذِينَ عَقَدَتْ أَيْمَانُكُمْ فَآتُوهُمْ نَصِيبَهُمْ ۚ إِنَّ اللَّهَ كَانَ عَلَىٰ كُلِّ شَيْءٍ شَهِيدًا,"For everyone We have appointed heirs to what the parents and near relatives leave, as well as those with whom you have made a compact; so give them their share [of the heritage]. Indeed Allah is witness to all things."
[4:34],الرِّجَالُ قَوَّامُونَ عَلَى النِّسَاءِ بِمَا فَضَّلَ اللَّهُ بَعْضَهُمْ عَلَىٰ بَعْضٍ وَبِمَا أَنفَقُوا مِنْ أَمْوَالِهِمْ ۚ فَالصَّالِحَاتُ قَانِتَاتٌ حَافِظَاتٌ لِّلْغَيْبِ بِمَا حَفِظَ اللَّهُ ۚ,"Men are the managers of women, because of the advantage Allah has granted some of them over others, and by virtue of their spending out of their wealth. Righteous women are obedient and watchful in the absence [of their husbands] in guarding what Allah has enjoined [them] to guard."
[4:34],وَاللَّاتِي تَخَافُونَ نُشُوزَهُنَّ فَعِظُوهُنَّ وَاهْجُرُوهُنَّ فِي الْمَضَاجِعِ وَاضْرِبُوهُنَّ ۖ فَإِنْ أَطَعْنَكُمْ فَلَا تَبْغُوا عَلَيْهِنَّ سَبِيلًا ۗ إِنَّ اللَّهَ كَانَ عَلِيًّا كَبِيرًا,"As for those [wives] whose misconduct you fear, [first] advise them, and [if ineffective] keep away from them in the bed, and [as the last resort] beat them. Then if they obey you, do not seek any course [of action] against them. Indeed Allah is all-exalted, all-great."
[4:35],وَإِنْ خِفْتُمْ شِقَاقَ بَيْنِهِمَا فَابْعَثُوا حَكَمًا مِّنْ أَهْلِهِ وَحَكَمًا مِّنْ أَهْلِهَا إِن يُرِيدَا إِصْلَاحًا يُوَفِّقِ اللَّهُ بَيْنَهُمَا ۗ إِنَّ اللَّهَ كَانَ عَلِيمًا خَبِيرًا,"If you fear a split between the two of them, then appoint an arbiter from his relatives and an arbiter from her relatives. If they desire reconcilement, Allah shall reconcile them. Indeed Allah is all-knowing, all-aware."
[4:36],وَاعْبُدُوا اللَّهَ وَلَا تُشْرِكُوا بِهِ شَيْئًا ۖ وَبِالْوَالِدَيْنِ إِحْسَانًا وَبِذِي الْقُرْبَىٰ وَالْيَتَامَىٰ وَالْمَسَاكِينِ وَالْجَارِ ذِي الْقُرْبَىٰ وَالْجَارِ الْجُنُبِ وَالصَّاحِبِ بِالْجَنبِ وَابْنِ السَّبِيلِ وَمَا مَلَكَتْ أَيْمَانُكُمْ ۗ,"Worship Allah and do not ascribe any partners to Him, and be good to parents, the relatives, the orphans, the needy, the near neighbour and the distant neighbour, the companion at your side, the traveller, and your slaves"
[4:36],إِنَّ اللَّهَ لَا يُحِبُّ مَن كَانَ مُخْتَالًا فَخُورًا,Indeed Allah does not like those who are arrogant and boastful.
[4:37],الَّذِينَ يَبْخَلُونَ وَيَأْمُرُونَ النَّاسَ بِالْبُخْلِ وَيَكْتُمُونَ مَا آتَاهُمُ اللَّهُ مِن فَضْلِهِ ۗ وَأَعْتَدْنَا لِلْكَافِرِينَ عَذَابًا مُّهِينًا,"—Those who are [themselves] stingy and bid [other] people to be stingy, and conceal whatever Allah has given them out of His bounty; and We have prepared for the faithless a humiliating punishment."
[4:38],وَالَّذِينَ يُنفِقُونَ أَمْوَالَهُمْ رِئَاءَ النَّاسِ وَلَا يُؤْمِنُونَ بِاللَّهِ وَلَا بِالْيَوْمِ الْآخِرِ ۗ وَمَن يَكُنِ الشَّيْطَانُ لَهُ قَرِينًا فَسَاءَ قَرِينًا,"And those who spend their wealth to be seen by people, and believe neither in Allah nor in the Last Day. As for him who has Satan for his companion—an evil companion is he!"
[4:39],وَمَاذَا عَلَيْهِمْ لَوْ آمَنُوا بِاللَّهِ وَالْيَوْمِ الْآخِرِ وَأَنفَقُوا مِمَّا رَزَقَهُمُ اللَّهُ ۚ وَكَانَ اللَّهُ بِهِمْ عَلِيمًا,"What harm would it have done them had they believed in Allah and the Last Day, and spent out of what Allah has provided them? Allah knows them well."
[4:40],إِنَّ اللَّهَ لَا يَظْلِمُ مِثْقَالَ ذَرَّةٍ ۖ وَإِن تَكُ حَسَنَةً يُضَاعِفْهَا وَيُؤْتِ مِن لَّدُنْهُ أَجْرًا عَظِيمًا,"Indeed Allah does not wrong [anyone] [even to the extent of] an atom’s weight, and if it be a good deed He doubles it[s reward], and gives from Himself a great reward."
[4:41],فَكَيْفَ إِذَا جِئْنَا مِن كُلِّ أُمَّةٍ بِشَهِيدٍ وَجِئْنَا بِكَ عَلَىٰ هَٰؤُلَاءِ شَهِيدًا,"So how shall it be, when We bring a witness from every nation and We bring you as a witness to them?"
[4:42],يَوْمَئِذٍ يَوَدُّ الَّذِينَ كَفَرُوا وَعَصَوُا الرَّسُولَ لَوْ تُسَوَّىٰ بِهِمُ الْأَرْضُ وَلَا يَكْتُمُونَ اللَّهَ حَدِيثًا,"On that day those who were faithless and [who] disobeyed the Apostle will wish the earth were levelled with them, and they will not conceal any matter from Allah."
[4:43],يَا أَيُّهَا الَّذِينَ آمَنُوا لَا تَقْرَبُوا الصَّلَاةَ وَأَنتُمْ سُكَارَىٰ حَتَّىٰ تَعْلَمُوا مَا تَقُولُونَ وَلَا جُنُبًا إِلَّا عَابِرِي سَبِيلٍ حَتَّىٰ تَغْتَسِلُوا ۚ,"But if you are sick or on a journey, or any of you has come from the toilet, or you have touched women, and you cannot find water, then make your ablution on clean ground and wipe a part of your faces and your hands. Indeed Allah is all-excusing, all-forgiving."
[4:43],وَإِن كُنتُم مَّرْضَىٰ أَوْ عَلَىٰ سَفَرٍ أَوْ جَاءَ أَحَدٌ مِّنكُم مِّنَ الْغَائِطِ أَوْ لَامَسْتُمُ النِّسَاءَ فَلَمْ تَجِدُوا مَاءً فَتَيَمَّمُوا صَعِيدًا طَيِّبًا فَامْسَحُوا بِوُجُوهِكُمْ وَأَيْدِيكُمْ ۗ إِنَّ اللَّهَ كَانَ عَفُوًّا غَفُورًا,"But if you are sick or on a journey, or any of you has come from the toilet, or you have touched women, and you cannot find water, then make your ablution on clean ground and wipe a part of your faces and your hands. Indeed Allah is all-excusing, all-forgiving."
[4:44],أَلَمْ تَرَ إِلَى الَّذِينَ أُوتُوا نَصِيبًا مِّنَ الْكِتَابِ يَشْتَرُونَ الضَّلَالَةَ وَيُرِيدُونَ أَن تَضِلُّوا السَّبِيلَ,"Have you not regarded those who were given a share of the Book, who purchase error and desire that you [too] should lose the way?"
[4:45],وَاللَّهُ أَعْلَمُ بِأَعْدَائِكُمْ ۚ وَكَفَىٰ بِاللَّهِ وَلِيًّا وَكَفَىٰ بِاللَّهِ نَصِيرًا,"But Allah knows your enemies better, and Allah suffices as guardian, and Allah suffices as helper."
[4:46],مِّنَ الَّذِينَ هَادُوا يُحَرِّفُونَ الْكَلِمَ عَن مَّوَاضِعِهِ وَيَقُولُونَ سَمِعْنَا وَعَصَيْنَا وَاسْمَعْ غَيْرَ مُسْمَعٍ وَرَاعِنَا لَيًّا بِأَلْسِنَتِهِمْ وَطَعْنًا فِي الدِّينِ ۚ,"Among the Jews are those who pervert words from their meanings and say, ‘We hear and disobey’ and ‘Hear without listening!’ and ‘Ra’ina,’ twisting their tongues and reviling the faith."
[4:46],وَلَوْ أَنَّهُمْ قَالُوا سَمِعْنَا وَأَطَعْنَا وَاسْمَعْ وَانظُرْنَا لَكَانَ خَيْرًا لَّهُمْ وَأَقْوَمَ وَلَٰكِن لَّعَنَهُمُ اللَّهُ بِكُفْرِهِمْ فَلَا يُؤْمِنُونَ إِلَّا قَلِيلًا,"But had they said, ‘We hear and obey’ and ‘Listen’ and ‘Unzurna,’ it would have been better for them and more upright. But Allah has cursed them for their faithlessness, so they will not believe except a few."
[4:47],يَا أَيُّهَا الَّذِينَ أُوتُوا الْكِتَابَ آمِنُوا بِمَا نَزَّلْنَا مُصَدِّقًا لِّمَا مَعَكُم مِّن قَبْلِ أَن نَّطْمِسَ وُجُوهًا فَنَرُدَّهَا عَلَىٰ أَدْبَارِهَا أَوْ نَلْعَنَهُمْ كَمَا لَعَنَّا أَصْحَابَ السَّبْتِ ۚ وَكَانَ أَمْرُ اللَّهِ مَفْعُولًا,"O you who were given the Book! Believe in what We have sent down confirming what is with you, before We blot out the faces and turn them backwards, or curse them as We cursed the People of the Sabbath, and Allah’s command is bound to be fulfilled."
[4:48],إِنَّ اللَّهَ لَا يَغْفِرُ أَن يُشْرَكَ بِهِ وَيَغْفِرُ مَا دُونَ ذَٰلِكَ لِمَن يَشَاءُ ۚ وَمَن يُشْرِكْ بِاللَّهِ فَقَدِ افْتَرَىٰ إِثْمًا عَظِيمًا,"Indeed Allah does not forgive that partners should be ascribed to Him, but He forgives anything besides that to whomever He wishes. Whoever ascribes partners to Allah has indeed fabricated [a lie] in great sinfulness."
[4:49],أَلَمْ تَرَ إِلَى الَّذِينَ يُزَكُّونَ أَنفُسَهُم ۚ بَلِ اللَّهُ يُزَكِّي مَن يَشَاءُ وَلَا يُظْلَمُونَ فَتِيلًا,"Have you not regarded those who style themselves as pure? Indeed, it is Allah who purifies whomever He wishes, and they will not be wronged [so much as] a single date-thread."
[4:50],انظُرْ كَيْفَ يَفْتَرُونَ عَلَى اللَّهِ الْكَذِبَ ۖ وَكَفَىٰ بِهِ إِثْمًا مُّبِينًا,"Look, how they fabricate lies against Allah! That suffices for a flagrant sin."
[4:51],أَلَمْ تَرَ إِلَى الَّذِينَ أُوتُوا نَصِيبًا مِّنَ الْكِتَابِ يُؤْمِنُونَ بِالْجِبْتِ وَالطَّاغُوتِ وَيَقُولُونَ لِلَّذِينَ كَفَرُوا هَٰؤُلَاءِ أَهْدَىٰ مِنَ الَّذِينَ آمَنُوا سَبِيلًا,"Have you not regarded those who were given a share of the Book, believing in idols and fake deities and saying of the pagans: ‘These are better guided on the way than the faithful’?"
[4:52],أُولَٰئِكَ الَّذِينَ لَعَنَهُمُ اللَّهُ ۖ وَمَن يَلْعَنِ اللَّهُ فَلَن تَجِدَ لَهُ نَصِيرًا,"They are the ones whom Allah has cursed, and whomever Allah curses, you will never find any helper for him."
[4:53],أَمْ لَهُمْ نَصِيبٌ مِّنَ الْمُلْكِ فَإِذًا لَّا يُؤْتُونَ النَّاسَ نَقِيرًا,"Do they have a share in sovereignty? If so, they will not give those people [so much as] a speck on a date-stone!"
[4:54],أَمْ يَحْسُدُونَ النَّاسَ عَلَىٰ مَا آتَاهُمُ اللَّهُ مِن فَضْلِهِ ۖ فَقَدْ آتَيْنَا آلَ إِبْرَاهِيمَ الْكِتَابَ وَالْحِكْمَةَ وَآتَيْنَاهُم مُّلْكًا عَظِيمًا,"Do they envy those people for what Allah has given them out of His bounty? We have certainly given the progeny of Abraham the Book and wisdom, and We have given them a great sovereignty."
[4:55],فَمِنْهُم مَّنْ آمَنَ بِهِ وَمِنْهُم مَّن صَدَّ عَنْهُ ۚ وَكَفَىٰ بِجَهَنَّمَ سَعِيرًا,"Of them are some who believe in him, and of them are some who deter [others] from him; and hell suffices for a blaze!"
[4:56],إِنَّ الَّذِينَ كَفَرُوا بِآيَاتِنَا سَوْفَ نُصْلِيهِمْ نَارًا كُلَّمَا نَضِجَتْ جُلُودُهُم بَدَّلْنَاهُمْ جُلُودًا غَيْرَهَا لِيَذُوقُوا الْعَذَابَ ۗ إِنَّ اللَّهَ كَانَ عَزِيزًا حَكِيمًا,"Indeed We shall soon make those who deny Our signs enter a Fire: as often as their skins become scorched, We shall replace them with other skins, so that they may taste the punishment. Indeed Allah is all-mighty, all-wise."
[4:57],وَالَّذِينَ آمَنُوا وَعَمِلُوا الصَّالِحَاتِ سَنُدْخِلُهُمْ جَنَّاتٍ تَجْرِي مِن تَحْتِهَا الْأَنْهَارُ خَالِدِينَ فِيهَا أَبَدًا ۖ لَّهُمْ فِيهَا أَزْوَاجٌ مُّطَهَّرَةٌ ۖ وَنُدْخِلُهُمْ ظِلًّا ظَلِيلًا,"As for those who have faith and do righteous deeds, We shall admit them into gardens with streams running in them, to remain in them forever. In it, there will be chaste mates for them, and We shall admit them into a deep shade."
[4:58],إِنَّ اللَّهَ يَأْمُرُكُمْ أَن تُؤَدُّوا الْأَمَانَاتِ إِلَىٰ أَهْلِهَا وَإِذَا حَكَمْتُم بَيْنَ النَّاسِ أَن تَحْكُمُوا بِالْعَدْلِ ۚ إِنَّ اللَّهَ نِعِمَّا يَعِظُكُم بِهِ ۗ إِنَّ اللَّهَ كَانَ سَمِيعًا بَصِيرًا,"Indeed Allah commands you to deliver the trusts to their [rightful] owners, and to judge with fairness when you judge between people. Excellent indeed is what Allah advises you. Indeed Allah is all-hearing, all-seeing."
[4:59],يَا أَيُّهَا الَّذِينَ آمَنُوا أَطِيعُوا اللَّهَ وَأَطِيعُوا الرَّسُولَ وَأُولِي الْأَمْرِ مِنكُمْ ۖ فَإِن تَنَازَعْتُمْ فِي شَيْءٍ فَرُدُّوهُ إِلَى اللَّهِ وَالرَّسُولِ إِن كُنتُمْ تُؤْمِنُونَ بِاللَّهِ وَالْيَوْمِ الْآخِرِ ۚ ذَٰلِكَ خَيْرٌ وَأَحْسَنُ تَأْوِيلًا,"O you who have faith! Obey Allah and obey the Apostle and those vested with authority among you. And if you dispute concerning anything, refer it to Allah and the Apostle, if you have faith in Allah and the Last Day. That is better and more favourable in outcome."
[4:60],أَلَمْ تَرَ إِلَى الَّذِينَ يَزْعُمُونَ أَنَّهُمْ آمَنُوا بِمَا أُنزِلَ إِلَيْكَ وَمَا أُنزِلَ مِن قَبْلِكَ يُرِيدُونَ أَن يَتَحَاكَمُوا إِلَى الطَّاغُوتِ وَقَدْ أُمِرُوا أَن يَكْفُرُوا بِهِ وَيُرِيدُ الشَّيْطَانُ أَن يُضِلَّهُمْ ضَلَالًا بَعِيدًا,"Have you not regarded those who claim that they believe in what has been sent down to you and what was sent down before you? They desire to seek the judgment of fake deities, though they were commanded to reject them, and Satan desires to lead them astray into far error."
[4:61],وَإِذَا قِيلَ لَهُمْ تَعَالَوْا إِلَىٰ مَا أَنزَلَ اللَّهُ وَإِلَى الرَّسُولِ رَأَيْتَ الْمُنَافِقِينَ يَصُدُّونَ عَنكَ صُدُودًا,"When they are told, ‘Come to what Allah has sent down and [come] to the Apostle,’ you see the hypocrites keep away from you aversely."
[4:62],فَكَيْفَ إِذَا أَصَابَتْهُم مُّصِيبَةٌ بِمَا قَدَّمَتْ أَيْدِيهِمْ ثُمَّ جَاءُوكَ يَحْلِفُونَ بِاللَّهِ إِنْ أَرَدْنَا إِلَّا إِحْسَانًا وَتَوْفِيقًا,"But how will it be when an affliction visits them because of what their hands have sent ahead? Then they will come to you, swearing by Allah, ‘We desired nothing but to do good and to bring about comity.’"
[4:63],أُولَٰئِكَ الَّذِينَ يَعْلَمُ اللَّهُ مَا فِي قُلُوبِهِمْ فَأَعْرِضْ عَنْهُمْ وَعِظْهُمْ وَقُل لَّهُمْ فِي أَنفُسِهِمْ قَوْلًا بَلِيغًا,"They are the ones whom Allah knows as to what is in their hearts. So let them alone, and advise them, and speak to them concerning themselves far-reaching words."
[4:64],وَمَا أَرْسَلْنَا مِن رَّسُولٍ إِلَّا لِيُطَاعَ بِإِذْنِ اللَّهِ ۚ وَلَوْ أَنَّهُمْ إِذ ظَّلَمُوا أَنفُسَهُمْ جَاءُوكَ فَاسْتَغْفَرُوا اللَّهَ وَاسْتَغْفَرَ لَهُمُ الرَّسُولُ لَوَجَدُوا اللَّهَ تَوَّابًا رَّحِيمًا,"We did not send any apostle but to be obeyed by Allah’s leave. Had they, when they wronged themselves, come to you and pleaded to Allah for forgiveness, and the Apostle had pleaded for them [to Allah]for forgiveness, they would have surely found Allah all-clement, all-merciful."
[4:65],فَلَا وَرَبِّكَ لَا يُؤْمِنُونَ حَتَّىٰ يُحَكِّمُوكَ فِيمَا شَجَرَ بَيْنَهُمْ ثُمَّ لَا يَجِدُوا فِي أَنفُسِهِمْ حَرَجًا مِّمَّا قَضَيْتَ وَيُسَلِّمُوا تَسْلِيمًا,"But no, by your Lord! They will not believe until they make you a judge in their disputes, then do not find within their hearts any dissent to your verdict and submit in full submission."
[4:66],وَلَوْ أَنَّا كَتَبْنَا عَلَيْهِمْ أَنِ اقْتُلُوا أَنفُسَكُمْ أَوِ اخْرُجُوا مِن دِيَارِكُم مَّا فَعَلُوهُ إِلَّا قَلِيلٌ مِّنْهُمْ ۖ وَلَوْ أَنَّهُمْ فَعَلُوا مَا يُوعَظُونَ بِهِ لَكَانَ خَيْرًا لَّهُمْ وَأَشَدَّ تَثْبِيتًا,"Had We prescribed for them, [commanding]: ‘Slay [the guilty among] your folks or leave your habitations,’ they would not have done it except a few of them. And if they had done as they were advised, it would have been better for them and stronger in confirming [their faith]."
[4:67],وَإِذًا لَّآتَيْنَاهُم مِّن لَّدُنَّا أَجْرًا عَظِيمًا,"Then We would surely have given them from Us a great reward,"
[4:68],وَلَهَدَيْنَاهُمْ صِرَاطًا مُّسْتَقِيمًا,and We would have guided them to a straight path.
