[4:69],وَمَن يُطِعِ اللَّهَ وَالرَّسُولَ فَأُولَٰئِكَ مَعَ الَّذِينَ أَنْعَمَ اللَّهُ عَلَيْهِم مِّنَ النَّبِيِّينَ وَالصِّدِّيقِينَ وَالشُّهَدَاءِ وَالصَّالِحِينَ ۚ وَحَسُنَ أُولَٰئِكَ رَفِيقًا,"Whoever obeys Allah and the Apostle—they are with those whom Allah has blessed, including the prophets and the truthful, the martyrs and the righteous, and excellent companions are they!"
[4:70],ذَٰلِكَ الْفَضْلُ مِنَ اللَّهِ ۚ وَكَفَىٰ بِاللَّهِ عَلِيمًا,"That is the grace of Allah, and Allah suffices as knower [of His creatures]."
[4:71],يَا أَيُّهَا الَّذِينَ آمَنُوا خُذُوا حِذْرَكُمْ فَانفِرُوا ثُبَاتٍ أَوِ انفِرُوا جَمِيعًا,"O you who have faith! Take your precautions, then go forth in companies, or go forth en masse."
[4:72],وَإِنَّ مِنكُمْ لَمَن لَّيُبَطِّئَنَّ فَإِنْ أَصَابَتْكُم مُّصِيبَةٌ قَالَ قَدْ أَنْعَمَ اللَّهُ عَلَيَّ إِذْ لَمْ أَكُن مَّعَهُمْ شَهِيدًا,"Among you is indeed he who drags his feet, and should an affliction visit you, he says, ‘It was certainly Allah’s blessing that I did not accompany them!’"
[4:73],وَلَئِنْ أَصَابَكُمْ فَضْلٌ مِّنَ اللَّهِ لَيَقُولَنَّ كَأَن لَّمْ تَكُن بَيْنَكُمْ وَبَيْنَهُ مَوَدَّةٌ يَا لَيْتَنِي كُنتُ مَعَهُمْ فَأَفُوزَ فَوْزًا عَظِيمًا,"But should a bounty from Allah come to you, he will say—as if there were no [tie of friendship and] affection between you and him—‘I wish I were with them so that I had achieved a great success!’"
[4:74],فَلْيُقَاتِلْ فِي سَبِيلِ اللَّهِ الَّذِينَ يَشْرُونَ الْحَيَاةَ الدُّنْيَا بِالْآخِرَةِ ۚ وَمَن يُقَاتِلْ فِي سَبِيلِ اللَّهِ فَيُقْتَلْ أَوْ يَغْلِبْ فَسَوْفَ نُؤْتِيهِ أَجْرًا عَظِيمًا,"Let those who sell the life of this world for the Hereafter fight in the way of Allah; and whoever fights in the way of Allah, and then is slain, or he subdues [the enemy], We shall soon give him a great reward."
[4:75],وَمَا لَكُمْ لَا تُقَاتِلُونَ فِي سَبِيلِ اللَّهِ وَالْمُسْتَضْعَفِينَ مِنَ الرِّجَالِ وَالنِّسَاءِ وَالْوِلْدَانِ الَّذِينَ يَقُولُونَ رَبَّنَا أَخْرِجْنَا مِنْ هَٰذِهِ الْقَرْيَةِ الظَّالِمِ أَهْلُهَا وَاجْعَل لَّنَا مِن لَّدُنكَ وَلِيًّا وَاجْعَل لَّنَا مِن لَّدُنكَ نَصِيرًا,"Why should you not fight in the way of Allah and the oppressed men, women, and children, who say, ‘Our Lord, bring us out of this town whose people are oppressors, and appoint for us a guardian from Yourself, and appoint for us a helper from Yourself’?"
[4:76],الَّذِينَ آمَنُوا يُقَاتِلُونَ فِي سَبِيلِ اللَّهِ ۖ وَالَّذِينَ كَفَرُوا يُقَاتِلُونَ فِي سَبِيلِ الطَّاغُوتِ فَقَاتِلُوا أَوْلِيَاءَ الشَّيْطَانِ ۖ إِنَّ كَيْدَ الشَّيْطَانِ كَانَ ضَعِيفًا,"Those who have faith fight in the way of Allah, and those who are faithless fight in the way of fake gods. So fight the friends of Satan; indeed the stratagems of Satan are always flimsy."
[4:77],أَلَمْ تَرَ إِلَى الَّذِينَ قِيلَ لَهُمْ كُفُّوا أَيْدِيَكُمْ وَأَقِيمُوا الصَّلَاةَ وَآتُوا الزَّكَاةَ فَلَمَّا كُتِبَ عَلَيْهِمُ الْقِتَالُ إِذَا فَرِيقٌ مِّنْهُمْ يَخْشَوْنَ النَّاسَ كَخَشْيَةِ اللَّهِ أَوْ أَشَدَّ خَشْيَةً ۚ,"Have you not regarded those who were told, ‘Keep your hands off [from warfare], and maintain the prayer and give the zakat’? But when fighting was prescribed for them, behold, a part of them feared the people as if fearing Allah, or were even more afraid,"
[4:77],وَقَالُوا رَبَّنَا لِمَ كَتَبْتَ عَلَيْنَا الْقِتَالَ لَوْلَا أَخَّرْتَنَا إِلَىٰ أَجَلٍ قَرِيبٍ ۗ قُلْ مَتَاعُ الدُّنْيَا قَلِيلٌ وَالْآخِرَةُ خَيْرٌ لِّمَنِ اتَّقَىٰ وَلَا تُظْلَمُونَ فَتِيلًا,"and they said, ‘Our Lord! Why did You prescribe fighting for us? Why did You not respite us for a short time?!’ Say, ‘The enjoyments of this world are trifle and the Hereafter is better for the Godwary, and you will not be wronged so much as a single date-thread."
[4:78],أَيْنَمَا تَكُونُوا يُدْرِككُّمُ الْمَوْتُ وَلَوْ كُنتُمْ فِي بُرُوجٍ مُّشَيَّدَةٍ ۗ وَإِن تُصِبْهُمْ حَسَنَةٌ يَقُولُوا هَٰذِهِ مِنْ عِندِ اللَّهِ ۖ وَإِن تُصِبْهُمْ سَيِّئَةٌ يَقُولُوا هَٰذِهِ مِنْ عِندِكَ ۚ,"Wherever you may be death will overtake you, even if you were in fortified towers.’ If any good befalls them, they say, ‘This is from Allah;’ and when an ill befalls them,"
[4:78],قُلْ كُلٌّ مِّنْ عِندِ اللَّهِ ۖ فَمَالِ هَٰؤُلَاءِ الْقَوْمِ لَا يَكَادُونَ يَفْقَهُونَ حَدِيثًا,"they say, ‘This is from you.’ Say, ‘All is from Allah.’ What is the matter with these people that they would not understand any matter?"
[4:79],مَّا أَصَابَكَ مِنْ حَسَنَةٍ فَمِنَ اللَّهِ ۖ وَمَا أَصَابَكَ مِن سَيِّئَةٍ فَمِن نَّفْسِكَ ۚ وَأَرْسَلْنَاكَ لِلنَّاسِ رَسُولًا ۚ وَكَفَىٰ بِاللَّهِ شَهِيدًا,"Whatever good befalls you is from Allah; and whatever ill befalls you is from yourself. We sent you as an apostle to mankind, and Allah suffices as witness."
[4:80],مَّن يُطِعِ الرَّسُولَ فَقَدْ أَطَاعَ اللَّهَ ۖ وَمَن تَوَلَّىٰ فَمَا أَرْسَلْنَاكَ عَلَيْهِمْ حَفِيظًا,Whoever obeys the Apostle certainly obeys Allah; and as for those who turn their backs [on you]; We have not sent you to keep watch over them.
[4:81],وَيَقُولُونَ طَاعَةٌ فَإِذَا بَرَزُوا مِنْ عِندِكَ بَيَّتَ طَائِفَةٌ مِّنْهُمْ غَيْرَ الَّذِي تَقُولُ ۖ وَاللَّهُ يَكْتُبُ مَا يُبَيِّتُونَ ۖ فَأَعْرِضْ عَنْهُمْ وَتَوَكَّلْ عَلَى اللَّهِ ۚ وَكَفَىٰ بِاللَّهِ وَكِيلًا,"They profess obedience [to you], but when they go out from your presence, a group of them conspire overnight [to do] something other than what you say. But Allah records what they conspire overnight. So disregard them and put your trust in Allah, for Allah suffices as trustee."
[4:82],أَفَلَا يَتَدَبَّرُونَ الْقُرْآنَ ۚ وَلَوْ كَانَ مِنْ عِندِ غَيْرِ اللَّهِ لَوَجَدُوا فِيهِ اخْتِلَافًا كَثِيرًا,"Do they not contemplate the Quran? Had it been from [someone] other than Allah, they would have surely found much discrepancy in it."
[4:83],وَإِذَا جَاءَهُمْ أَمْرٌ مِّنَ الْأَمْنِ أَوِ الْخَوْفِ أَذَاعُوا بِهِ ۖ وَلَوْ رَدُّوهُ إِلَى الرَّسُولِ وَإِلَىٰ أُولِي الْأَمْرِ مِنْهُمْ لَعَلِمَهُ الَّذِينَ يَسْتَنبِطُونَهُ مِنْهُمْ ۗ,"When a report of safety or alarm comes to them, they immediately broadcast it; but had they referred it to the Apostle or to those vested with authority among them, those of them who investigate would have ascertained it."
[4:83],وَلَوْلَا فَضْلُ اللَّهِ عَلَيْكُمْ وَرَحْمَتُهُ لَاتَّبَعْتُمُ الشَّيْطَانَ إِلَّا قَلِيلًا,"And were it not for Allah’s grace upon you and His mercy, you would have surely followed Satan, [all] except a few."
[4:84],فَقَاتِلْ فِي سَبِيلِ اللَّهِ لَا تُكَلَّفُ إِلَّا نَفْسَكَ ۚ وَحَرِّضِ الْمُؤْمِنِينَ ۖ عَسَى اللَّهُ أَن يَكُفَّ بَأْسَ الَّذِينَ كَفَرُوا ۚ وَاللَّهُ أَشَدُّ بَأْسًا وَأَشَدُّ تَنكِيلًا,"So fight in the way of Allah: you are responsible only for yourself, but urge on the faithful [to fight]. Maybe Allah will curb the might of the faithless, for Allah is greatest in might and severest in punishment."
[4:85],مَّن يَشْفَعْ شَفَاعَةً حَسَنَةً يَكُن لَّهُ نَصِيبٌ مِّنْهَا ۖ وَمَن يَشْفَعْ شَفَاعَةً سَيِّئَةً يَكُن لَّهُ كِفْلٌ مِّنْهَا ۗ وَكَانَ اللَّهُ عَلَىٰ كُلِّ شَيْءٍ مُّقِيتًا,"Whoever intercedes for a good cause shall receive a share of it, and whoever intercedes for an evil cause shall share its burden, and Allah is prepotent over all things."
[4:86],وَإِذَا حُيِّيتُم بِتَحِيَّةٍ فَحَيُّوا بِأَحْسَنَ مِنْهَا أَوْ رُدُّوهَا ۗ إِنَّ اللَّهَ كَانَ عَلَىٰ كُلِّ شَيْءٍ حَسِيبًا,"When you are greeted with a salute, greet with a better one than it, or return it; indeed Allah takes account of all things."
[4:87],اللَّهُ لَا إِلَٰهَ إِلَّا هُوَ ۚ لَيَجْمَعَنَّكُمْ إِلَىٰ يَوْمِ الْقِيَامَةِ لَا رَيْبَ فِيهِ ۗ وَمَنْ أَصْدَقُ مِنَ اللَّهِ حَدِيثًا,"Allah—there is no god except Him—will surely gather you on the Day of Resurrection, in which there is no doubt; and who is more truthful in speech than Allah?"
[4:88],فَمَا لَكُمْ فِي الْمُنَافِقِينَ فِئَتَيْنِ وَاللَّهُ أَرْكَسَهُم بِمَا كَسَبُوا ۚ أَتُرِيدُونَ أَن تَهْدُوا مَنْ أَضَلَّ اللَّهُ ۖ وَمَن يُضْلِلِ اللَّهُ فَلَن تَجِدَ لَهُ سَبِيلًا,"Why should you be two groups concerning the hypocrites, while Allah has made them relapse [into unfaith] because of their deeds? Do you desire to guide someone Allah has led astray? Whomever Allah leads astray, you will never find any way for him."
[4:89],وَدُّوا لَوْ تَكْفُرُونَ كَمَا كَفَرُوا فَتَكُونُونَ سَوَاءً ۖ فَلَا تَتَّخِذُوا مِنْهُمْ أَوْلِيَاءَ حَتَّىٰ يُهَاجِرُوا فِي سَبِيلِ اللَّهِ ۚ,"They are eager that you should disbelieve like they have disbelieved, so that you all become alike. So do not make friends [with anyone] from among them, until they migrate in the way of Allah."
[4:89],فَإِن تَوَلَّوْا فَخُذُوهُمْ وَاقْتُلُوهُمْ حَيْثُ وَجَدتُّمُوهُمْ ۖ وَلَا تَتَّخِذُوا مِنْهُمْ وَلِيًّا وَلَا نَصِيرًا,"But if they turn their backs, seize them and kill them wherever you find them, and do not take from among them friends or helpers,"
[4:90],إِلَّا الَّذِينَ يَصِلُونَ إِلَىٰ قَوْمٍ بَيْنَكُمْ وَبَيْنَهُم مِّيثَاقٌ أَوْ جَاءُوكُمْ حَصِرَتْ صُدُورُهُمْ أَن يُقَاتِلُوكُمْ أَوْ يُقَاتِلُوا قَوْمَهُمْ ۚ,"excepting those who join a people between whom and you there is a treaty, or such as come to you with hearts reluctant to fight you, or to fight their own people."
[4:90],إوَلَوْ شَاءَ اللَّهُ لَسَلَّطَهُمْ عَلَيْكُمْ فَلَقَاتَلُوكُمْ ۚ فَإِنِ اعْتَزَلُوكُمْ فَلَمْ يُقَاتِلُوكُمْ وَأَلْقَوْا إِلَيْكُمُ السَّلَمَ فَمَا جَعَلَ اللَّهُ لَكُمْ عَلَيْهِمْ سَبِيلًا,"Had Allah wished, He would have imposed them upon you, and then they would have surely fought you. So if they keep out of your way and do not fight you, and offer you peace, then Allah does not allow you any course [of action] against them."
[4:91],سَتَجِدُونَ آخَرِينَ يُرِيدُونَ أَن يَأْمَنُوكُمْ وَيَأْمَنُوا قَوْمَهُمْ كُلَّ مَا رُدُّوا إِلَى الْفِتْنَةِ أُرْكِسُوا فِيهَا ۚ,"You will find others desiring to be secure from you, and secure from their own people; yet whenever they are called back to polytheism, they relapse into it."
[4:91],سفَإِن لَّمْ يَعْتَزِلُوكُمْ وَيُلْقُوا إِلَيْكُمُ السَّلَمَ وَيَكُفُّوا أَيْدِيَهُمْ فَخُذُوهُمْ وَاقْتُلُوهُمْ حَيْثُ ثَقِفْتُمُوهُمْ ۚ وَأُولَٰئِكُمْ جَعَلْنَا لَكُمْ عَلَيْهِمْ سُلْطَانًا مُّبِينًا,"So if they do not keep out of your way, nor offer you peace, nor keep their hands off [from fighting], then seize them and kill them wherever you confront them, and it is such against whom We have given you a clear sanction."
[4:92],وَمَا كَانَ لِمُؤْمِنٍ أَن يَقْتُلَ مُؤْمِنًا إِلَّا خَطَأً ۚ وَمَن قَتَلَ مُؤْمِنًا خَطَأً فَتَحْرِيرُ رَقَبَةٍ مُّؤْمِنَةٍ وَدِيَةٌ مُّسَلَّمَةٌ إِلَىٰ أَهْلِهِ إِلَّا أَن يَصَّدَّقُوا ۚ فَإِن كَانَ مِن قَوْمٍ عَدُوٍّ لَّكُمْ وَهُوَ مُؤْمِنٌ فَتَحْرِيرُ رَقَبَةٍ مُّؤْمِنَةٍ ۖ,"A believer may not kill another believer, unless it is by mistake. Anyone who kills a believer by mistake should set free a believing slave, and pay blood-money to his family, unless they remit it in charity. If he belongs to a people that are hostile to you but is a believer, then a believing slave is to be set free.."
[4:92],وَإِن كَانَ مِن قَوْمٍ بَيْنَكُمْ وَبَيْنَهُم مِّيثَاقٌ فَدِيَةٌ مُّسَلَّمَةٌ إِلَىٰ أَهْلِهِ وَتَحْرِيرُ رَقَبَةٍ مُّؤْمِنَةٍ ۖ فَمَن لَّمْ يَجِدْ فَصِيَامُ شَهْرَيْنِ مُتَتَابِعَيْنِ تَوْبَةً مِّنَ اللَّهِ ۗ وَكَانَ اللَّهُ عَلِيمًا حَكِيمًا,"And if he belongs to a people with whom you have a treaty, the blood-money is to be paid to his family and a believing slave is to be set free. He who cannot afford [to pay the blood-money], must fast two successive months as a penance from Allah, and Allah is all-knowing, all-wise."
[4:93],وَمَن يَقْتُلْ مُؤْمِنًا مُّتَعَمِّدًا فَجَزَاؤُهُ جَهَنَّمُ خَالِدًا فِيهَا وَغَضِبَ اللَّهُ عَلَيْهِ وَلَعَنَهُ وَأَعَدَّ لَهُ عَذَابًا عَظِيمًا,"Should anyone kill a believer intentionally, his requital shall be hell, to remain in it [forever]; Allah shall be wrathful at him and curse him and He shall prepare for him a great punishment."
[4:94],يَا أَيُّهَا الَّذِينَ آمَنُوا إِذَا ضَرَبْتُمْ فِي سَبِيلِ اللَّهِ فَتَبَيَّنُوا وَلَا تَقُولُوا لِمَنْ أَلْقَىٰ إِلَيْكُمُ السَّلَامَ لَسْتَ مُؤْمِنًا تَبْتَغُونَ عَرَضَ الْحَيَاةِ الدُّنْيَا فَعِندَ اللَّهِ مَغَانِمُ كَثِيرَةٌ ۚ,"O you who have faith! When you issue forth in the way of Allah, try to ascertain: do not say to someone who offers you peace, ‘You are not a believer,’ seeking the transitory wares of the life of this world"
[4:94],كَذَٰلِكَ كُنتُم مِّن قَبْلُ فَمَنَّ اللَّهُ عَلَيْكُمْ فَتَبَيَّنُوا ۚ إِنَّ اللَّهَ كَانَ بِمَا تَعْمَلُونَ خَبِيرًا,"Yet with Allah are plenteous gains. You too were such earlier, but Allah did you a favour. Therefore, do ascertain. Allah is indeed well aware of what you do."
[4:95],لَّا يَسْتَوِي الْقَاعِدُونَ مِنَ الْمُؤْمِنِينَ غَيْرُ أُولِي الضَّرَرِ وَالْمُجَاهِدُونَ فِي سَبِيلِ اللَّهِ بِأَمْوَالِهِمْ وَأَنفُسِهِمْ ۚ,Not equal are those of the faithful who sit back—excepting those who suffer from some disability—and those who wage jihad in the way of Allah with their possession and their persons.
[4:95],فَضَّلَ اللَّهُ الْمُجَاهِدِينَ بِأَمْوَالِهِمْ وَأَنفُسِهِمْ عَلَى الْقَاعِدِينَ دَرَجَةً ۚ وَكُلًّا وَعَدَ اللَّهُ الْحُسْنَىٰ ۚ وَفَضَّلَ اللَّهُ الْمُجَاهِدِينَ عَلَى الْقَاعِدِينَ أَجْرًا عَظِيمًا,"Allah has graced those who wage jihad with their possessions and their persons by a degree over those who sit back; yet to each Allah has promised the best reward, and Allah has graced those who wage jihad over those who sit back with a great reward:"
[4:96],دَرَجَاتٍ مِّنْهُ وَمَغْفِرَةً وَرَحْمَةً ۚ وَكَانَ اللَّهُ غَفُورًا رَّحِيمًا,"ranks from Him, forgiveness, and mercy, and Allah is all-forgiving, all-merciful."
[4:97],إِنَّ الَّذِينَ تَوَفَّاهُمُ الْمَلَائِكَةُ ظَالِمِي أَنفُسِهِمْ قَالُوا فِيمَ كُنتُمْ ۖ قَالُوا كُنَّا مُسْتَضْعَفِينَ فِي الْأَرْضِ ۚ قَالُوا أَلَمْ تَكُنْ أَرْضُ اللَّهِ وَاسِعَةً فَتُهَاجِرُوا فِيهَا ۚ فَأُولَٰئِكَ مَأْوَاهُمْ جَهَنَّمُ ۖ وَسَاءَتْ مَصِيرًا,"Indeed, those whom the angels take away while they are wronging themselves, they ask, ‘What state were you in?’ They reply, ‘We were oppressed in the land.’ They say, ‘Was not Allah’s earth vast enough so that you might migrate in it?’ The refuge of such shall be hell, and it is an evil destination."
[4:98],إِلَّا الْمُسْتَضْعَفِينَ مِنَ الرِّجَالِ وَالنِّسَاءِ وَالْوِلْدَانِ لَا يَسْتَطِيعُونَ حِيلَةً وَلَا يَهْتَدُونَ سَبِيلًا,"Except the oppressed among men, women and children, who have neither access to any means nor are guided to any way."
[4:99],فَأُولَٰئِكَ عَسَى اللَّهُ أَن يَعْفُوَ عَنْهُمْ ۚ وَكَانَ اللَّهُ عَفُوًّا غَفُورًا,"Maybe Allah will excuse them, for Allah is all-excusing, all-forgiving."
[4:100],وَمَن يُهَاجِرْ فِي سَبِيلِ اللَّهِ يَجِدْ فِي الْأَرْضِ مُرَاغَمًا كَثِيرًا وَسَعَةً ۚ وَمَن يَخْرُجْ مِن بَيْتِهِ مُهَاجِرًا إِلَى اللَّهِ وَرَسُولِهِ ثُمَّ يُدْرِكْهُ الْمَوْتُ فَقَدْ وَقَعَ أَجْرُهُ عَلَى اللَّهِ ۗ وَكَانَ اللَّهُ غَفُورًا رَّحِيمًا,"Whoever migrates in the way of Allah will find many havens and plenitude in the earth. And whoever leaves his home migrating toward Allah and His Apostle, and is then overtaken by death, his reward shall certainly fall on Allah, and Allah is all-forgiving, all-merciful."
[4:101],وَإِذَا ضَرَبْتُمْ فِي الْأَرْضِ فَلَيْسَ عَلَيْكُمْ جُنَاحٌ أَن تَقْصُرُوا مِنَ الصَّلَاةِ إِنْ خِفْتُمْ أَن يَفْتِنَكُمُ الَّذِينَ كَفَرُوا ۚ إِنَّ الْكَافِرِينَ كَانُوا لَكُمْ عَدُوًّا مُّبِينًا,"When you journey in the land, there is no sin upon you in shortening the prayers, if you fear that the faithless may trouble you; indeed the faithless are your manifest enemies."
[4:102],وَإِذَا كُنتَ فِيهِمْ فَأَقَمْتَ لَهُمُ الصَّلَاةَ فَلْتَقُمْ طَائِفَةٌ مِّنْهُم مَّعَكَ وَلْيَأْخُذُوا أَسْلِحَتَهُمْ فَإِذَا سَجَدُوا فَلْيَكُونُوا مِن وَرَائِكُمْ,"When you are among them, leading them in prayers, let a group of them stand with you, carrying their weapons. And when they have done the prostrations, let them withdraw to the rear,"
[4:102],وَلْتَأْتِ طَائِفَةٌ أُخْرَىٰ لَمْ يُصَلُّوا فَلْيُصَلُّوا مَعَكَ وَلْيَأْخُذُوا حِذْرَهُمْ وَأَسْلِحَتَهُمْ ۗ وَدَّ الَّذِينَ كَفَرُوا لَوْ تَغْفُلُونَ عَنْ أَسْلِحَتِكُمْ وَأَمْتِعَتِكُمْ فَيَمِيلُونَ عَلَيْكُم مَّيْلَةً وَاحِدَةً ۚ,"then let the other group which has not prayed come and pray with you, taking their precautions and [bearing] their weapons. The faithless are eager that you should be oblivious of your weapons and your baggage, so that they could assault you all at once."
[4:102],وَلَا جُنَاحَ عَلَيْكُمْ إِن كَانَ بِكُمْ أَذًى مِّن مَّطَرٍ أَوْ كُنتُم مَّرْضَىٰ أَن تَضَعُوا أَسْلِحَتَكُمْ ۖ وَخُذُوا حِذْرَكُمْ ۗ إِنَّ اللَّهَ أَعَدَّ لِلْكَافِرِينَ عَذَابًا مُّهِينًا,"But there is no sin upon you, if you are troubled by rain or are sick, to set aside your weapons; but take your precautions. Indeed Allah has prepared for the faithless a humiliating punishment."
[4:103],فَإِذَا قَضَيْتُمُ الصَّلَاةَ فَاذْكُرُوا اللَّهَ قِيَامًا وَقُعُودًا وَعَلَىٰ جُنُوبِكُمْ ۚ فَإِذَا اطْمَأْنَنتُمْ فَأَقِيمُوا الصَّلَاةَ ۚ إِنَّ الصَّلَاةَ كَانَتْ عَلَى الْمُؤْمِنِينَ كِتَابًا مَّوْقُوتًا,"When you have finished the prayers, remember Allah, standing, sitting, and lying down, and when you feel secure, perform the [complete] prayers, for the prayer is indeed a timed prescription for the faithful."
[4:104],وَلَا تَهِنُوا فِي ابْتِغَاءِ الْقَوْمِ ۖ إِن تَكُونُوا تَأْلَمُونَ فَإِنَّهُمْ يَأْلَمُونَ كَمَا تَأْلَمُونَ ۖ وَتَرْجُونَ مِنَ اللَّهِ مَا لَا يَرْجُونَ ۗ وَكَانَ اللَّهُ عَلِيمًا حَكِيمًا,"Do not slacken in the pursuit of these people. If you are suffering, they are also suffering like you, but you expect from Allah what they do not expect, and Allah is all-knowing, all-wise."
[4:105],إِنَّا أَنزَلْنَا إِلَيْكَ الْكِتَابَ بِالْحَقِّ لِتَحْكُمَ بَيْنَ النَّاسِ بِمَا أَرَاكَ اللَّهُ ۚ وَلَا تَكُن لِّلْخَائِنِينَ خَصِيمًا,"Indeed We have sent down to you the Book with the truth, so that you may judge between the people by what Allah has shown you; do not be an advocate for the traitors,"
[4:106],وَاسْتَغْفِرِ اللَّهَ ۖ إِنَّ اللَّهَ كَانَ غَفُورًا رَّحِيمًا,"and plead to Allah for forgiveness; indeed Allah is all-forgiving, all-merciful."
[4:107],وَلَا تُجَادِلْ عَنِ الَّذِينَ يَخْتَانُونَ أَنفُسَهُمْ ۚ إِنَّ اللَّهَ لَا يُحِبُّ مَن كَانَ خَوَّانًا أَثِيمًا,And do not plead for those who betray themselves; indeed Allah does not like someone who is treacherous and sinful.
