,أللَّهُمَّ وَمَا أَلْمَمْنَا بِهِ فِي شَهْرِنَا هَذَا مِنْ لَمَم أَوْ إثْم،,"O God, as for the small and large sins which we have committed in this our month,"
,أَوْ وَاقَعْنَا فِيهِ مِنْ ذَنْبِ وَاكْتَسَبْنَا فِيهِ مِنْ خَطِيئَة,"the misdeeds into which we have fallen, and the offenses which we have earned"
,عَلَى تَعَمُّد مِنَّا أو عَلى نِسيانٍ ظَلَمنا فيه أنفُسَنا أَوِ انْتَهَكْنَا بِهِ حُرْمَةً مِنْ غَيْرِنَا,"purposefully or in forgetfulness, wronging ourselves thereby or violating the respect due to others,"
,فَصَلِّ عَلَى مُحَمَّد وَآلِهِ وَاسْتُرْنَا بِسِتْرِكَ،,"bless Muhammad and his Household, cover us over with Your covering,"
,وَاعْفُ عَنَّا بِعَفْوِكَ،,"pardon us through Your pardoning,"
,وَلاَ تَنْصِبْنَا فِيهِ لاِعْيُنِ الشَّامِتِينَ،,"place us not before the eyes of the gloaters because of that,"
,وَلاَ تَبْسُطْ عَلَيْنَا فِيهِ أَلْسُنَ الطَّاعِنينَ،,"stretch not toward us the tongues of the defamers,"
,وَاسْتَعْمِلْنَا بِمَا يَكُونُ حِطَّةً وَكَفَّارَةً,and employ us in that which will alleviate and expiate
,لِمَا أَنْكَرْتَ مِنَّا فِيهِ بِرَأْفَتِكَ الَّتِي لاَ تَنْفَدُ،,"whatever You disapprovest from us within it through Your clemency which does not run out,"
,وَفَضْلِكَ الَّذِي لا يَنْقُصُ.,and Your bounty which does not diminish!
,أللَّهُمَّ صَلِّ عَلَى مُحَمَّد وَآلِهِ,"O God, bless Muhammad and his Household,"
,وَاجْبُرْ مُصِيبَتنَا بِشَهْرِنَا,"redress our being afflicted by our month,"
,وَبَارِكْ فِي يَوْمِ عِيْدِنَا وَفِطْرِنَا,"bless us in this day of our festival and our fast-breaking,"
,وَاجْعَلْهُ مِنْ خَيْرِ يَوْم مَرَّ عَلَيْنَا أَجْلَبِهِ لِعَفْو، وَأَمْحَاهُ لِذَنْبِ،,"make it one of the best of days that have passed over us, the greatest in attracting Your pardon, and the most effacing toward sins,"
,وَاغْفِرْ لَنا ما خَفِيَ مِنْ ذُنُوبِنَا وَمَا عَلَنَ.,"and forgive us our sins, both the concealed and the public!"
,أللَّهُمَّ اسلَخْنَا بِانْسِلاَخِ هَذَا الشَّهْرِ مِنْ خَطَايَانَا,"O God, with the passing of this month make us pass forth from our offenses,"
,وَأَخْرِجْنَا بُخُرُوجِهِ مِنْ سَيِّئاتِنَا,"with its departure make us depart from our evil deeds,"
,وَاجْعَلْنَا مِنْ أَسْعَدِ أَهْلِهِ بِهِ,"and appoint us thereby among its most felicitous people,"
,وَأَجْزَلِهِمْ قِسَمَاً فِيـهِ وَأَوْفَـرِهِمْ حَظّاً مِنْـهُ.,"the most plentiful of them in portion, and the fullest of them in share!"
,أللّهُمَّ وَمَنْ رَعَى حَقّ هَذَا الشَّهْرِ حَقَّ رِعَايَتِهِ,"O God, when any person observes this month as it should be observed,"
,وَحَفِظَ حُرْمَتَهُ حَقَّ حِفْظِهَا وَقَامَ بِحُدُودِهِ حَقَّ قِيَامِهَا،,"safeguards its inviolability as it should be safeguarded, attends to its bounds as they should be attended to,"
,وَأتَّقَى ذُنُوبَهُ حَقَّ تُقَاتِهَا أَوْ تَقَرَّبَ إلَيْكَ بِقُرْبَة,"fears its misdeeds as they should be feared, or seeks nearness to You with any act of nearness-seeking"
,أَوْجَبَتْ رِضَاكَ لَهُ وَعَطَفَتْ رَحْمَتَكَ عَلَيْهِ،,"which makes incumbent upon him Your good pleasure and bends toward him Your mercy,"
,فَهَبْ لَنَا مِثْلَهُ مِنْ وُجْدِكَ,give to us the like [of that] from Your wealth
,وَأَعْطِنَا أَضْعَافَهُ مِنْ فَضْلِكَ,"and bestow it upon us in multiples through Your bounty,"
,فَإنَّ فَضْلَكَ، لا يَغِيْضُ وَإنَّ خَـزَائِنَكَ لا تَنْقُصُ، بَـلْ تَفِيضُ,"for Your bounty does not diminish, Your treasuries do not decrease but overflow,"
,وَإنَّ مَعَـادِنَ إحْسَانِكَ لا تَفْنَى،,"the mines of Your beneficence are not exhausted,"
,وَإنَّ عَطَاءَكَ لَلْعَطَآءُ الْمُهَنَّا،,and Your bestowal is the bestowal full of delight!
,أللَّهُمَّ صَلِّ عَلَى مُحَمَّد وَآلِهِ,"O God, bless Muhammad and his Household"
,وَاكْتُبْ لَنَا مِثْلَ أجُورِ مَنْ صَامَهُ,and write for us the like of the wages of him who fasted in it
,أَوْ تَعَبَّدَ لَكَ فِيْهِ إلَى يَوْمِ الْقِيَامَةِ.,or worshipped You within it until the Day of Resurrection!
,أللَّهُمَّ إنَّا نَتُوبُ إلَيْكَ فِي يَوْمِ فِطْرِنَا,"O God, we repent to You in our day of fast-breaking,"
,الّذِي جَعَلْتَهُ لِلْمُؤْمِنِينَ عِيداً وَسُـرُوراً.,which You hast appointed for the faithful a festival and a joy
,وَلأِهْلِ مِلَّتِكَ مَجْمَعاً وَمُحْتشداً مِنْ كُلِّ ذَنْب أَذْنَبْنَاهُ،,"and for the people of Your creed a time of assembly and gathering, from every misdeed we did,"
,أَوْ سُوْء أَسْلَفْنَاهُ، أَوْ خَاطِرِ شَرٍّ أَضْمَرْنَاهُ،,"ill work we sent ahead, or evil thought we secretly conceived,"
,تَوْبَةَ مَنْ لاَ يَنْطَوِيْ عَلَى رُجُوع إلَى ذَنْب,the repentance of one who does not harbour a return to sin
,وَلا يَعُودُ بَعْدَهَا فِي خَطِيئَة،,"and who afterwards will not go back to offense,"
,تَوْبَةً نَصوحاً خَلَصَتْ مِنَ الشَّكِّ وَالارْتِيَابِ،,an unswerving repentance rid of doubt and wavering.
,فَتَقَبَّلْهَا مِنَّا وَارْضَ عَنَّا وَثَبِّتنَا عَلَيْهَا.,"So accept it from us, be pleased with us, and fix us within it!"
,أللَّهُمَّ ارْزُقْنَا خَوْفَ عِقَابِ الْوَعِيدِ،,"God, provide us with fear of the threatened punishment"
,وَشَوْقَ ثَوَابِ الْمَوْعُودِ حَتّى نَجِدَ لَذَّةَ مَا نَدْعُوكَ بِهِ،,"and yearning for the promised reward, so that we may find the pleasure of that for which we supplicate You"
,وكَأْبَةَ مَا نَسْتَجِيْرُكَ مِنْهُ،,and the sorrow of that from which we seek sanctuary in You!
,وَاجْعَلْنَا عِنْدَكَ مِنَ التَّوَّابِيْنَ الَّذِينَ أَوْجَبْتَ لَهُمْ مَحَبَّتَكَ،,"And place us with You among the repenters, those upon whom You hast made Your love obligatory"
,وَقَبِلْتَ مِنْهُمْ مُرَاجَعَةَ طَاعَتِكَ، يَا أَعْدَلَ الْعَادِلِينَ.,and from whom You hast accepted the return to obeying You! O Most Just of the just!
,أللَّهُمَّ تَجَاوَزْ عَنْ آبآئِنَا وَأُمَّهَاتِنَا وَأَهْلِ دِيْنِنَا جَمِيعاً,"O God, show forbearance toward our fathers and our mothers and all the people of our religion,"
,مَنْ سَلَفَ مِنْهُمْ وَمَنْ غَبَرَ إلَى يَوْمِ الْقِيَامَةِ.,"those who have gone and those who will pass by, until the Day of Resurrection!"
,أللَّهُمَّ صَلِّ عَلَى مُحَمَّد نَبِيِّنَا وَآلِهِ،,"O God, bless our prophet Muhammad and his Household,"
,كَمَا صَلَّيْتَ عَلَى مَلائِكَتِكَ الْمُقَرَّبِينَ.,"as You hast blessed Your angels brought nigh,"
,وَصَلِّ عَلَيْهِ وَآلِهِ،,"bless him and his Household,"
,كَمَا صَلَّيْتَ عَلَى أَنْبِيَائِكَ الْمُرْسَلِينَ،,"as You hast blessed Your prophets sent out,"
,وَصَلِّ عَلَيْهِ وَآلِهِ، كَمَا صَلَّيْتَ عَلَى عِبَادِكَ الصَّالِحِينَ،,"bless him and his Household, as You hast blessed Your righteous servants"
,وَأَفْضَلَ مِنْ ذَلِكَ يَا رَبَّ الْعَالَمِينَ،,"- and better than that, O Lord of the worlds!"
,صَلاَةً تَبْلُغُنَا بَرَكَتُهَا، وَيَنَالُنَا نَفْعُهَا،,"a blessing whose benediction will reach us, whose benefit will attain to us,"
,وَيُسْتَجَابُ لَهَا دُعَاؤُنَا،,and through which our supplication may be granted!
,إنَّكَ أكْرَمُ مَنْ رُغِبَ إلَيْهِ,"You art the most generous of those who are beseeched,"
,وَأكْفَى مَنْ تُوُكِّلَ عَلَيْهِ,"the most sufficient of those in whom confidence is had,"
,وَأَعْطَى مَنْ سُئِلَ مِنْ فَضْلِهِ،,"the most bestowing of those from whom bounty is asked,"
,وَأَنْتَ عَلَى كُلِّ شَيْء قَدِيرٌ.,You art powerful over everything!
,اَللَّهُمَّ صَلِّ عَلَى مُحَمَّدٍ وَ آلِ مُحَمَّد,"O Allah, bless Muhammad and the family of Muhammad."
