,وَلكِنْ عِلْمُكَ فِينَا وَعِلْمُنَا بِأَنَّكَ لاَ تَصْرِفُنَا عَنْكَ,"Yet, Your knowledge about us and our knowledge that You shall never let us down"
,حَثَّنَا عَلَىٰ ٱلرَّغْبَةِ إِلَيْكَ,have urged us to desire for You
,وَإِنْ كُنَّا غَيْرَ مُسْتَوْجِبِينَ لِرَحْمَتِكَ,even if we do not deserve Your mercy.
,فَأَنْتَ أَهْلٌ أَنْ تَجُودَ عَلَيْنَا وَعَلَىٰ ٱلْمُذْنِبِينَ بِفَضْلِ سَعَتِكَ,"However, You are the worthiest of conferring upon us and upon the guilty with the grace of Your broad benevolence."
,فَٱمْنُنْ عَلَيْنَا بِمَا أَنْتَ أَهْلُهُ,"So, confer upon us with that of which You are worthy"
,وَجُدْ عَلَيْنَا فَإِنَّا مُحْتَاجُونَ إِلَىٰ نَيْلِكَ,"and act generously towards us, for we are in need for Your conferral."
,يَا غَفَّارُ بِنُورِكَ ٱهْتَدَيْنَا,"O Oft-Forgiving, in Your light have we found the right path,"
,وَبِفَضْلِكَ ٱسْتَغْنَيْنَا,"due to Your favor have we dispensed with the others,"
,وَبِنِعْمَتِكَ أَصْبَحْنَا وَأَمْسَيْنَا,and Your grace have we experienced in morns and eves.
,ذُنُوبُنَا بَيْنَ يَدَيْكَ,Our sins are before You;
,نَسْتَغْفِرُكَ ٱللَّهُمَّ مِنْهَا وَنَتُوبُ إِلَيْكَ,"we beseech You, O Allah, to forgive them and we repent before You."
,تَتَحَبَّبُ إِلَيْنَا بِٱلنِّعَمِ وَنُعَارِضُكَ بِٱلذُّنُوبِ,"Whilst You show affection to us through Your graces, we take ourselves away from You through our sins."
,خَيْرُكَ إِلَيْنَا نَازِلٌ,You good descend upon us
,وَشَرُّنَا إِلَيْكَ صَاعِدٌ,while our evildoing ascends to You.
,وَلَمْ يَزَلْ وَلاَ يَزَالُ مَلَكٌ كَرِيمٌ يَأْتِيكَ عَنَّا بِعَمَلٍ قَبِيحٍ,"Albeit that a noble angel always carries to You our offensive deeds,"
,فَلاَ يَمْنَعُكَ ذٰلِكَ مِنْ أَنْ تَحُوطَنَا بِنِعَمِكَ,this has never made you stop encompassing us with Your graces
,وتَتَفَضَّلَ عَلَيْنَا بِآلاَئِكَ,and conferring upon us your elegances.
,فَسُبْحَانَكَ مَا أَحْلَمَكَ وَأَعْظَمَكَ,"Glory be to You! How Forbearing, Magnificent,"
,وَأَكْرَمَكَ مُبْدِئاً وَمُعِيداً,and Generous You are at all times!
,تَقَدَّسَتْ أَسْمَاؤُكَ,Sacred be Your Names.
,وَجَلَّ ثَنَاؤُكَ,Grand be Your praise.
,وَكَرُمَ صَنَائِعُكَ وَفِعَالُكَ,Munificent be Your deeds and acts.
,أَنْتَ إِلٰهِي أَوْسَعُ فَضْلاً وَأَعْظَمُ حِلْماً,"You, O my God, are too expansive in graciousness and too great in forbearance"
,مِنْ أَنْ تُقَايِسَنِي بِفِعْلِي وَخَطِيئَتِي,to punish me for my evildoings and sins.
,فَٱلْعَفْوَ ٱلْعَفْوَ ٱلْعَفْوَ,(Here I am asking for) Amnesty! Amnesty! Amnesty!
,سَيِّدِي سَيِّدِي سَيِّدِي,O my Lord! O my Lord! O my Lord!
,اَللَّهُمَّ أَشْغَلْنَا بِذِكْرِكَ,"O Allah, cause us to be engaged with mentioning You,"
,وَأَعِذْنَا مِنْ سَخَطِكَ,"save us from Your wrath,"
,وَأَجِرْنَا مِنْ عَذَابِكَ,"deliver us from Your torture,"
,وَٱرْزُقْنَا مِنْ مَوَاهِبِكَ,"grant us Your donations,"
,وَأَنْعِمْ عَلَيْنَا مِنْ فَضْلِكَ,"confer upon us with Your grace,"
,وَٱرْزُقْنَا حَجَّ بَيْتِكَ,and provide us the opportunity to go on pilgrimage to Your House
,وَزِيَارَةَ قَبْرِ نَبِيِّكَ,"and to visit the tomb of Your Prophet,"
,صَلَوَاتُكَ وَرَحْمَتُكَ,"may Your blessings, mercy,"
,وَمَغْفِرَتُكَ وَرِضْوَانُكَ عَلَيْهِ وَعَلَىٰ أَهْلِ بَيْتِهِ,"forgiveness, and pleasure be upon him and his Household."
,إِنَّكَ قَرِيبٌ مُجِيبٌ,"Verily, You are nigh and ready to answer."
,وَٱرْزُقْنَا عَمَلاً بِطَاعَتِكَ,"Bless us with acting upon the obedience to You,"
,وَتَوَفَّنَا عَلَىٰ مِلَّتِكَ وَسُنَّةِ نَبِيِّكَ,"and receive us following the rule of You and Your Prophet,"
,صَلَّىٰ ٱللَّهُ عَلَيْهِ وَعَلَىٰ آلِهِ,blessings of Allah be on him and on his Household.
,اَللَّهُمَّ ٱغْفِرْ لِي وَلِوَالِدَيَّ,"O Allah, forgive me and my parents,"
,وَٱرْحَمْهُمَا كَمَا رَبَّيَانِي صَغِيراً,and have mercy on them as they cared for me when I was little.
,إِجْزِهِمَا بِٱلإِحْسَانِ إِحْسَاناً,Reward them generously for their good deeds
,وَبِٱلسَّيِّئَاتِ غُفْرَاناً,and forgive their sins.
,اَللَّهُمَّ ٱغْفِرْ لِلْمُؤْمِنِينَ وَٱلْمُؤْمِنَاتِ,"O Allah, forgive the faithful men and women,"
,ٱلأَحْيَاءِ مِنْهُمْ وَٱلأَمْوَاتِ,"be they alive or dead,"
,وَتَابِعْ بَيْنَنَا وَبَيْنَهُمْ بِٱلْخَيْرَاتِ,and join us together in bliss and happiness.
,اَللَّهُمَّ ٱغْفِرْ لِحَيِّنَا وَمَيِّتِنَا,"O Allah, forgive our living and dead persons,"
,وَشَاهِدِنَا وَغَائِبِنَا,"our present and absent ones,"
,ذَكَرِنَا وَأُنْثَانَا,"our male and female ones,"
,صَغِيرِنَا وَكَبِيرِنَا,"our infants and adults,"
,حُرِّنَا وَمَمْلُوكِنَا,and our free ones and slaves.
,كَذَبَ ٱلْعَادِلُونَ بِٱللَّهِ,Liars are those who ascribe rivals to Allah;
,وَضَلُّوٱ ضَلاَلاً بَعِيداً,they have wandered far astray
,وَخَسِرُوٱ خُسْرَاناً مُبِيناً,and they will have suffered a manifest loss.
,اَللَّهُمَّ صَلِّ عَلَىٰ مُحَمَّدٍ وَآلِ مُحَمَّدٍ,"O Allah, send blessings to Muhammad and the Household of Muhammad,"
,وَٱخْتِمْ لِي بِخَيْرٍ,"seal my life with decency,"
,وَٱكْفِنِي مَا أَهَمَّنِي مِنْ أَمْرِ دُنْيَايَ وَآخِرَتِي,"help me overcome all that which aggrieves me in this world as well as the Hereafter,"
,وَلاَ تُسَلِّطْ عَلَيَّ مَنْ لاَ يَرْحَمُنِي,"do not let him who does not have mercy upon me prevail on me,"
,وَٱجْعَلْ عَلَيَّ مِنْكَ وَاقِيَةً بَاقِيَةً,"always keep on me an everlasting, protective covering,"
,وَلاَ تَسْلُبْنِي صَالِحَ مَا أَنْعَمْتَ بِهِ عَلَيَّ,"do not divest me of the well-mannered graces that You have conferred upon me,"
,وَٱرْزُقْنِي مِنْ فَضْلِكَ رِزْقاً وَاسِعاً حَلاَلاً طَيِّباً,"and provide me, out of Your grace, with lawfully gotten, delightful sustenance."
,اَللَّهُمَّ ٱحْرُسْنِي بِحَرَاسَتِكَ,"O Allah, keep me under Your alert surveillance,"
,وَٱحْفَظْنِي بِحِفْظِكَ,"protect me with Your support,"
,وَٱكْلَأْنِي بِكَلاَءَتِكَ,"take care of me with Your comprehensive care,"
,وَٱرْزُقْنِي حَجَّ بَيْتِكَ ٱلْحَرَامِ,grant me opportunity to go on pilgrimage to Your Holy House
,فِي عَامِنَا هٰذَا وَفِي كُلِّ عَامٍ,"in this year as well as all coming years,"
,وَزِيَارَةَ قَبْرِ نَبِيِّكَ وَٱلأَئِمَّةِ عَلَيْهِمُ ٱلسَّلامُ,"grant me to go on pilgrimage to the tombs of Your Prophet and the Imams, peace be upon them,"
,وَلاَ تُخْلِنِي يَا رَبِّ مِنْ تِلْكَ ٱلْمَشَاهِدِ ٱلشَّرِيفَةِ,"and do not deprive me, O Lord, of such honorable scenes"
,وَٱلْمَوَاقِفِ ٱلْكَرِيمَةِ,and noble situations.
,اَللَّهُمَّ تُبْ عَلَيَّ حَتَّىٰ لاَ أَعْصِيَكَ,"O Allah, accept my repentance so that I will not disobey you ever again,"
,وَأَلْهِمْنِي ٱلْخَيْرَ وَٱلْعَمَلَ بِهِ,"inspire me with goodness, good-doing,"
,وَخَشْيَتَكَ بِٱللَّيْلِ وَٱلنَّهَارِ مَا أَبْقَيْتَنِي,and fear of You all over day and night as long as You keep me alive.
,يَا رَبَّ ٱلْعَالَمِينَ,O Lord of the worlds!
,اَللَّهُمَّ إِنِّي كُلَّمَا قُلْتُ قَدْ تَهَيَّأْتُ وَتَعَبَّأْتُ,"O Allah, each time I decide to prepare and ready myself"
,وَقُمْتُ لِلصَّلاَةِ بَيْنَ يَدَيْكَ وَنَاجَيْتُكَ,"for offering prayers before You and conversing confidentially with You,"
,أَلْقَيْتَ عَلَيَّ نُعَاساً إِذَا أَنَا صَلَّيْتُ,You throw on me slumber whenever I stand for prayer;
,وَسَلَبْتَنِي مُنَاجَاتَكَ إِذَا أَنَا نَاجَيْتُ,"thus, You deprive me of conversing with You confidentially whenever I try so."
,مَالِي كُلَّمَا قُلْتُ قَدْ صَلُحَتْ سَرِيرَتِي,What is the wrong with me? Whenever I feel that my inner self has become decent
,وَقَرُبَ مِنْ مَجَالِسِ ٱلتَّوَّابِينَ مَجْلِسِي,"and that my session has become similar to the sessions of those who turn much to You,"
,عَرَضَتْ لِي بَلِيَّةٌ أَزَالَتْ قَدَمِي وَحَالَتْ بَيْنِي وَبَيْنَ خِدْمَتِكَ,"a misfortune would inflict me, causing my feet to be shaken, and standing against my showing servitude to You."
,سَيِّدِي لَعَلَّكَ عَنْ بَابِكَ طَرَدْتَنِي,"O my Master, perhaps You have pushed me away from Your door"
,وَعَنْ خِدْمَتِكَ نَحَّيْتَنِي,and You have dismissed me from Your service!
,أَوْ لَعَلَّكَ رَأَيْتَنِي مُسْتَخِفّاً بِحَقِّكَ فَأَقْصَيْتَنِي,"Or, perhaps, You have noticed that I belittled the duties that You have made incumbent upon me, and You thus set me aside!"
,أَوْ لَعَلَّكَ رَأَيْتَنِي مُعْرِضاً عَنْكَ فَقَلَيْتَنِي,"Or, perhaps, You have seen me turning away from You and thus You have turned away from me!"
,أَوْ لَعَلَّكَ وَجَدْتَنِي فِي مَقَامِ ٱلْكَاذِبِينَ فَرَفَضْتَنِي,"Or, perhaps, You have found me in the manner of the liars and thus You have rejected me!"
,أَوْ لَعَلَّكَ رَأَيْتَنِي غَيْرَ شَاكِرٍ لِنَعْمَائِكَ فَحَرَمْتَنِي,"Or, perhaps, You have observed me showing no gratitude for Your graces and thus You have deprived me of them!"
,أَوْ لَعَلَّكَ فَقَدْتَنِي مِنْ مَجَالِسِ ٱلْعُلَمَاءِ فَخَذَلْتَنِي,"Or, perhaps, You have not found me in the meetings of the scholars and thus You have let me down!"
,أَوْ لَعَلَّكَ رَأَيْتَنِي فِي ٱلْغَافِلِينَ فَمِنْ رَحْمَتِكَ آيَسْتَنِي,"Or, perhaps, You have seen me among the inattentive ones and thus You have made me despair of Your mercy!"
,أَوْ لَعَلَّكَ رَأَيْتَنِي آلِفَ مَجَالِسِ ٱلْبَطَّالِينَ فَبَيْنِي وَبَيْنَهُمْ خَلَّيْتَنِي,"Or, perhaps, You have found me fond of the sessions of the wrongdoers and thus You have referred me to them!"
,أَوْ لَعَلَّكَ لَمْ تُحِبَّ أَنْ تَسْمَعَ دُعَائِي فَبَاعَدْتَنِي,"Or, perhaps, You have not willed to hear my prayers and thus You have kept me away from You!"
,أَوْ لَعَلَّكَ بِجُرْمِي وَجَرِيرَتِي كَافَيْتَنِي,"Or, perhaps, You have punished me for my offenses and sins!"
,أَوْ لَعَلَّكَ بِقِلَّةِ حَيَائِي مِنْكَ جَازَيْتَنِي,"Or, perhaps, You have penalized me for my shamelessness!"
,فَإِنْ عَفَوْتَ يَا رَبِّ فَطَالَمَا عَفَوْتَ عَنِ ٱلْمُذْنِبِينَ قَبْلِي,"If You forgive me, O Lord, then You have occasionally forgiven the sinners like me,"
,لأَنَّ كَرَمَكَ أَيْ رَبِّ يَجِلُّ عَنْ مُكَافَاةِ ٱلْمُقَصِّرِينَ,"because Your compassion, O my Lord, is too great to be compared to the punishment of the negligent."
,وَأَنَا عَائِذٌ بِفَضْلِكَ هَارِبٌ مِنْكَ إِلَيْكَ,"I am now seeking refuge with Your generosity and fleeing for You to You,"
,مُتَنَجِّزٌ مَا وَعَدْتَ مِنَ ٱلصَّفْحِ عَمَّنْ أَحْسَنَ بِكَ ظَنّاً,hoping for the promise that You have taken as regards pardoning those who have good idea about You.
,إِلٰهِي أَنْتَ أَوْسَعُ فَضْلاً,"O my God, You are too expansive in favor"
,وَأَعْظَمُ حِلْماً مِنْ أَنْ تُقَايِسَنِي بِعَمَلِي,and too great in forbearance to punish me for my deed
,أَوْ أَنْ تَسْتَزِلَّنِي بِخَطِيئَتِي,or to chastise me for my sin.
,وَمَا أَنَا يَا سَيِّدِي وَمَا خَطَرِي,What am I? O Master! What is my weight?
,هَبْنِي بِفَضْلِكَ سَيِّدِي,"Excuse me out of Your favor, O my Master,"
,وَتَصَدَّقْ عَلَيَّ بِعَفْوِكَ,"act to me charitably our of Your pardon,"
,وَجَلِّلْنِي بِسِتْرِكَ,"cover me with Your covering,"
,وَٱعْفُ عَنْ تَوْبِيخِي بِكَرَمِ وَجْهِكَ,and let off chiding me out of the liberality of Your Face.
,سَيِّدِي أَنَا ٱلصَّغِيرُ ٱلَّذِي رَبَّيْتَهُ,"O my Master! I am the little that You have brought up,"
,وَأَنَا ٱلْجَاهِلُ ٱلَّذِي عَلَّمْتَهُ,"I am the ignorant that You have taught,"
,وَأَنَا ٱلضَّالُّ ٱلَّذِي هَدَيْتَهُ,"I am the straying that You have guided,"
,وَأَنَا ٱلْوَضِيعُ ٱلَّذِي رَفَعْتَهُ,"I am the humble that You have given rise,"
,وَأَنَا ٱلْخَائِفُ ٱلَّذِي آمَنْتَهُ,"I am the afraid that You have given security,"
,وَٱلْجَائِعُ ٱلَّذِي أَشْبَعْتَهُ,"I am the hungry that You have satiated,"
,وَٱلْعَطْشَانُ ٱلَّذِي أَرْوَيْتَهُ,"I am the thirsty that You have watered,"
,وَٱلْعَارِي ٱلَّذِي كَسَوْتَهُ,"I am the naked that You have dressed,"
,وَٱلْفَقِيرُ ٱلَّذِي أَغْنَيْتَهُ,"I am the poor that You have given affluence,"
,وَٱلضَّعِيفُ ٱلَّذِي قَوَّيْتَهُ,"I am the weak that You have strengthened,"
,وَٱلذَّلِيلُ ٱلَّذِي أَعْزَزْتَهُ,"I am the lowly that You have given might,"
,وَٱلسَّقِيمُ ٱلَّذِي شَفَيْتَهُ,"I am the ill that You have cured,"
,وَٱلسَّائِلُ ٱلَّذِي أَعْطَيْتَهُ,"I am the beggar that You have donated,"
,وَٱلْمُذْنِبُ ٱلَّذِي سَتَرْتَهُ,"I am the sinner that You have covered,"
,وَٱلْخَاطِئُ ٱلَّذِي أَقَلْتَهُ,"I am the guilty that You have excused,"
,وَأَنَا ٱلْقَلِيلُ ٱلَّذِي كَثَّرْتَهُ,"I am the valueless that You have evaluated,"
,وَٱلْمُسْتَضْعَفُ ٱلَّذِي نَصَرْتَهُ,"I am the helpless that You have backed,"
,وَأَنَا ٱلطَّرِيدُ ٱلَّذِي آوَيْتَهُ,and I am the expelled that You have boarded.
,أَنَا يَا رَبِّ ٱلَّذِي لَمْ أَسْتَحْيِكَ فِي ٱلْخَلاَءِ,"I am, O my Lord, the one who has not felt ashamed of You in secrets"
,وَلَمْ أُرَاقِبْكَ فِي ٱلْمَلاَءِ,and the one who has not considered Your watching over him in the public.
,أَنَا صَاحِبُ ٱلدَّوَاهِي ٱلْعُظْمَىٰ,"I am the committer of the grave transgressions,"
,أَنَا ٱلَّذِي عَلَىٰ سَيِّدِهِ ٱجْتَرأَ,"I am the one who challenged his Master,"
,أَنَا ٱلَّذِي عَصَيْتُ جَبَّارَ ٱلسَّمَاءِ,"I am the one who disobeyed the All-great of the heavens,"
,أَنَا ٱلَّذِي أَعْطَيْتُ عَلَىٰ مَعَاصِي ٱلْجَلِيلِ ٱلرِّشَىٰ,"I am the one who has given bribes violating the laws of the All-lofty Lord,"
,أَنَا ٱلَّذِي حِينَ بُشِّرْتُ بِهَا خَرَجْتُ إِلَيْهَا أَسْعَىٰ,"I am the one who has been delighted for committing such sins,"
,أَنَا ٱلَّذِي أَمْهَلْتَنِي فَمَا ٱرْعَوَيْتُ,"I am the one who, although You have respited, has not cared,"
,وَسَتَرْتَ عَلَيَّ فَمَا ٱسْتَحْيَيْتُ,"I am the one whom, although You have covered him, has not felt ashamed,"
,وَعَمِلْتُ بِٱلْمَعَاصِي فَتَعَدَّيْتُ,"who committed so many acts of disobedience that he has violated (all terms),"
,وَأَسْقَطْتَنِي مِنْ عَيْنِكَ فَمَا بَالَيْتُ,"and who, although You have disregarded, has not minded."
,فَبِحِلْمِكَ أَمْهَلْتَنِي,"So, out of Your forbearance have You given me respite."
,وَبِسِتْرِكَ سَتَرْتَنِي حَتَّىٰ كَأَنَّكَ أَغْفَلْتَنِي,You have concealed (my faults) with Your untouchable concealment as if You have been unaware of my acts.
,وَمِنْ عُقُوبَاتِ ٱلْمَعَاصِي جَنَّبْتَنِي حَتَّىٰ كَأَنَّكَ ٱسْتَحْيَيْتَنِي,You have not applied to me the punishments of committing acts of disobedience (to You) as if You are ashamed to face me.
,إِلٰهِي لَمْ أَعْصِكَ حِينَ عَصَيْتُكَ وَأَنَا بِرُبُوبِيَّتِكَ جَاحِدٌ,"O my God, as I disobeyed You, I have never denied Your Lordship,"
,وَلاَ بِأَمْرِكَ مُسْتَخِفٌّ,"have never belittled Your ordains,"
,وَلاَ لِعُقُوبَتِكَ مُتَعَرِّضٌ,"have never wished for exposing myself to Your chastisement,"
,وَلاَ لِوَعِيدِكَ مُتَهَاوِنٌ,and have never disparaged Your threat.
,لَكِنْ خَطِيئَةٌ عَرَضَتْ وَسَوَّلَتْ لِي نَفْسِي,"Nevertheless, sins showed themselves desirable before me, my self commended to me,"
,وَغَلَبَنِي هَوَايَ,"my whim overwhelmed me,"
,وَأَعَانَنِي عَلَيْهَا شِقْوَتِي,"my impudence helped me accordingly,"
,وَغَرَّنِي سِتْرُكَ ٱلْمُرْخَىٰ عَلَيَّ,and I have been deceived by Your covering that You have laid on me.
,فَقَدْ عَصَيْتُكَ وَخَالَفْتُكَ بِجُهْدِي,"So, I have exerted efforts in violating Your orders and disobeying You."
,فَٱلآنَ مِنْ عَذَابِكَ مَنْ يَسْتَنْقِذُنِي,"Now, who can ever save me from Your chastisement?"
,وَمِنْ أَيْدِي ٱلْخُصَمَاءِ غَداً مَنْ يُخَلِّصُنِي,"Tomorrow, who can save me from the hands of my rivals?"
,وَبِحَبْلِ مَنْ أَتَّصِلُ إِنْ أَنْتَ قَطَعْتَ حَبْلَكَ عَنِّي,Whose rope will I catch if You cut off the rope between You and me?
,فَوَاسَوْأَتَا عَلَىٰ مَا أَحْصَىٰ كِتَابُكَ مِنْ عَمَلِي,Shame on me for my evildoings that Your Book has recorded.
,ٱلَّذِي لَوْلاَ مَا أَرْجُو مِنْ كَرَمِكَ وَسَعَةِ رَحْمَتِكَ,"Had it not been for Your generosity, the breadth of Your mercy,"
,وَنَهْيِكَ إِيَّايَ عَنِ ٱلَّذِي لْقُنُوطِ لَقَنَطْتُ عِنْدَمَا أَتَذَكَّرُهَا,"and Your warning me against being desperate—the matters that I hopefully depend on, I would have despaired whenever I remember my sins."
,يَا خَيْرَ مَنْ دَعَاهُ دَاعٍ,O Greatest Besought Who has been ever besought!
,وَأَفْضَلَ مَنْ رَجَاهُ رَاجٍ,O Most Favorable Hoped!
,اَللَّهُمَّ بِذِمَّةِ ٱلإِسْلاَمِ أَتَوَسَّلُ إِلَيْكَ,"O Allah! I beseech You in the name of the liability of Islam,"
,وَبِحُرْمَةِ ٱلْقُرْآنِ أَعْتَمِدُ عَلَيْكَ,"I rely upon You in the name of the sanctity of the Qur’an,"
,وَبِحُبِّي ٱلنَّبِيَّ ٱلأُمِّيَّ,"in the name of my love for the Prophet; the Ummi (inhabitant of Mecca),"
,ٱلْقُرَشِيَّ ٱلْهَاشِمِيَّ,"the Qurayshite, the Hashemite,"
,ٱلْعَرَبِيَّ ٱلتُّهَامِيَّ,"the Arab, the Tuhamite,"
,ٱلْمَكِّيَّ ٱلْمَدَنِيَّ,"the Meccan, and the Madanite,"
,أَرْجُو ٱلزُّلْفَةَ لَدَيْكَ,I hope for proximity to You.
,فَلاَ تُوحِشِ ٱسْتِينَاسَ إِيـمَانِي,"So, do not disturb my familiarity with faith"
,وَلاَ تَجْعَلْ ثَوَابِي ثَوَابَ مَنْ عَبَدَ سِوَاكَ,and do not make my reward the same as reward given to those who serve one other than You.
,فَإِنَّ قَوْماً آمَنُوٱ بِأَلْسِنَتِهِمْ لِيَحْقِنُوٱ بِهِ دِمَاءَهُمْ,"Certainly, some people outwardly declared the faith so that they could prevent their blood from being shed."
,فَأَدْرَكُوٱ مَا أَمَّلُوٱ,"However, they attained their goals."
,وَإِنَّا آمَنَّا بِكَ بِأَلْسِنَتِنَا وَقُلُوبِنَا لِتَعْفُوَ عَنَّا,We have believed in You by heart and tongue so that You may excuse us.
,فَأَدْرِكْنَا مَا أَمَّلْنَا,"Hence, make us attain our goals,"
,وَثَبِّتْ رَجَاءَكَ فِي صُدُورِنَا,"make firm our hope for You in our hearts,"
,وَلاَ تُزِغْ قُلُوبَنَا بَعْدَ إِذْ هَدَيْتَنَا,"make not our hearts to deviate after You have guided us aright,"
,وَهَبْ لَنَا مِنْ لَدُنْكَ رَحْمَةً,and grant us from You mercy.
,إِنَّكَ أَنْتَ ٱلْوَهَّابُ,"Surely, You are the most liberal Giver."
,فَوَعِزَّتِكَ لَوِ ٱنْتَهَرْتَنِي مَا بَرِحْتُ مِنْ بَابِكَ,"By Your Majesty I swear, O my Lord, even if You chide me, I shall never leave Your Door"
,وَلاَ كَفَفْتُ عَنْ تَمَلُّقِكَ,and I shall never stop flattering You.
,لِمَا أُلْهِمَ قَلْبِي مِنَ ٱلْمَعْرِفَةِ بِكَرَمِكَ وَسَعَةِ رَحْمَتِكَ,This is because I have full acquaintance with Your (indescribable) generosity and bounty.
,إِلَىٰ مَنْ يَذْهَبُ ٱلْعَبْدُ إِلاَّ إِلَىٰ مَوْلاهُ,To whom may a servant go save to his Lord?
,وَإِلَىٰ مَنْ يَلْتَجِئُ ٱلْمَخْلُوقُ إِلاَّ إِلَىٰ خَالِقِهِ,To whom may a mortal resort save to his Creator?
,إِلٰهِي لَوْ قَرَنْتَنِي بِٱلأَصْفَادِ,"O my God, even if You tie me with chains,"
,وَمَنَعْتَنِي سَيْبَكَ مِنْ بَيْنِ ٱلأَشْهَادِ,"deprive me of the stream of Your bounties in the presence of people,"
,وَدَلَلْتَ عَلَىٰ فَضَائِحِي عُيُونَ ٱلْعِبَادِ,"divulge all my scandalous acts before the eyes of all Your servants,"
,وَأَمَرْتَ بِي إِلَىٰ ٱلنَّارِ,"order me to Hell,"
,وَحُلْتَ بَيْنِي وَبَيْنَ ٱلأَبْرَارِ,"and prevent me from communicating the Pious ones,"
,مَا قَطَعْتُ رَجَائِي مِنْكَ,"(in spite of all that) I will never stop hoping for You,"
,وَمَا صَرَفْتُ تَأْمِيلِي لِلْعَفْوِ عَنْكَ,"I will never stop expecting Your pardon,"
,وَلاَ خَرَجَ حُبُّكَ مِنْ قَلْبِي,and Your love will never exit my heart.
,أَنَا لاَ أَنْسَىٰ أَيَادِيَكَ عِنْدِي,I never forget Your graces that I enjoy
,وَسِتْرَكَ عَلَيَّ فِي دَارِ ٱلدُّنْيَا,and Your having concealed my defects in the worldly abode.
,سَيِّدِي أَخْرِجْ حُبَّ ٱلدُّنْيَا مِنْ قَلْبِي,"O my Master, (please) expel love for the world out of my heart,"
