,وَٱجْمَعْ بَيْنِي وَبَيْنَ ٱلْمُصْطَفَىٰ وَآلِهِ,"join me with the Divinely-chosen Prophet and his Household,"
,خِيَرَتِكَ مِنْ خَلْقِكَ وَخَاتَمِ ٱلنَّبِيِّينَ,the choicest of Your creatures and the seal of the Prophets:
,مُحَمَّدٍ صَلَّىٰ ٱللَّهُ عَلَيْهِ وَعَلَىٰ آلِهِ,"Muhammad, blessings of Allah be on him and on his Household."
,وَٱنْقُلْنِي إِلَىٰ دَرَجَةِ ٱلتَّوْبَةِ إِلَيْكَ,"Move me to the rank of repentance with You,"
,وَأَعِنِّي بِٱلْبُكَاءِ عَلَىٰ نَفْسِي فَقَدْ أَفْنَيْتُ عُمْرِي,"help me weep for myself after I have come upon the last of my age,"
,وَقَدْ نَزَلْتُ مَنْزِلَةَ ٱلآيِسِينَ مِنْ خَيْرِي,being in the manner of those who despair of any self-decency.
,فَمَنْ يَكُونُ أَسْوَأَ حَالاً مِنِّي,Who is then worse than I am
,إِنْ أَنَا نُقِلْتُ عَلَىٰ مِثْلِ حَالِي,"when I, such being my case, will be taken to a grave"
,إِلَىٰ قَبْرٍ لَمْ أُمَهِّدْهُ لِرَقْدَتِي,that I have neither paved for my long stay
,وَلَمْ أَفْرُشْهُ بِٱلْعَمَلِ ٱلصَّالِحِ لِضَجْعَتِي,nor furnished with righteous deed for my extended abode.
,وَمَا لِي لاَ أَبْكِي,Why should I not weep
,وَلاَ أَدْرِي إِلَىٰ مَا يَكُونُ مَصِيرِي,while I do not know what my destiny will be?
,وَأَرَىٰ نَفْسِي تُخَادِعُنِي,"And while I notice that my self is cheating me,"
,وَأَيَّامِي تُخَاتِلُنِي,"my days are deceiving me,"
,وَقَدْ خَفَقَتْ عِنْدَ رَأْسِي أَجْنِحَةُ ٱلْمَوْتِ,and the wings of death are fluttering over my head.
,فَمَا لِي لاَ أَبْكِي,"So, why should I not weep?"
,أَبْكِي لِخُرُوجِ نَفْسِي,I weep for my soul’s departing my body.
,أَبْكِي لِظُلْمَةِ قَبْرِي,I weep for the darkness of my grave.
,أَبْكِي لِضِيقِ لَحْدِي,I weep for the narrowness of my vault.
,أَبْكِي لِسُؤَالِ مُنْكَرٍ وَنَكِيرٍ إِيَّايَ,I weep for Munkar and Nakir (the two angels interrogating in graves) being interrogating me.
,أَبْكِي لِخُرُوجِي مِنْ قَبْرِي عُرْيَاناً ذَلِيلاً,"I weep for my coming out of my grave (on the Resurrection Day) naked, humiliated,"
,حَامِلاً ثِقْلِي عَلَىٰ ظَهْرِي,"carrying my burdens on my back,"
,أَنْظُرُ مَرَّةً عَنْ يَمِينِي وَأُخْرَىٰ عَنْ شِمَالِي,distributing my sights to my right and my left.
,إِذِ ٱلْخَلائِقُ فِي شَأْنٍ غَيْرِ شَأْنِي,Behold! The creatures will each be engaged with matters other than mine.
,”لِكُلِّ ٱمْرِئٍ مِنْهُمْ يَوْمَئِذٍ شَأْنٌ يُغْنِيهِ“,Every man that day will have concern enough to make him heedless of others.
,”وُجُوهٌ يَوْمَئِذٍ مُسْفِرَةٌ ضَاحِكَةٌ مُسْتَبْشِرَةٌ,"Many faces on that day shall be bright, laughing, joyous."
,وَوُجُوهٌ يَوْمَئِذٍ عَلَيْهَا غَبَرَةٌ تَرْهَقُهَا قَتَرَةٌ“ وَذِلَّةٌ,"And many faces on that day, on them shall be dust. Darkness, and humiliation shall cover them."
,سَيِّدِي عَلَيْكَ مُعَوَّلِي وَمُعْتَمَدِي,"O my Master, on You I depend and rely."
,وَرَجَائِي وَتَوَكُّلِي,In You I put my hope and faith.
,وَبِرَحْمَتِكَ تَعَلُّقِي,To Your mercy I hang.
,تُصِيبُ بِرَحْمَتِكَ مَنْ تَشَاءُ,You direct Your mercy towards whomsoever You like
,وَتَهْدِي بِكَرَامَتِكَ مَنْ تُحِبُّ,"and You guide, out of Your honoring, whomsoever You will."
,فَلَكَ ٱلْحَمْدُ عَلَىٰ مَا نَقَّيْتَ مِنَ ٱلشِّرْكِ قَلْبِي,"So, all praise be to You for You have purified my heart from polytheism."
,وَلَكَ ٱلْحَمْدُ عَلَىٰ بَسْطِ لِسَانِي,All praise be to You for You have made my tongue express utterly.
,أَفَبِلِسَانِي هٰذَا ٱلْكَالِّ أَشْكُرُكَ,How can I praise You properly while my tongue is too short to do so?
,أَمْ بِغَايَةِ جُهْدِي فِي عَمَلِي أُرْضِيكَ,How can I please You while the extent of my efforts is too short to do so?
,وَمَا قَدْرُ لِسَانِي يَا رَبِّ فِي جَنْبِ شُكْرِكَ,What extent can my tongue reach if compared to the limitless extent of thanking You?
,وَمَا قَدْرُ عَمَلِي فِي جَنْبِ نِعَمِكَ وَإِحْسَانِكَ,What amount can my efforts reach if compared to the limitless amount of Your graces and favors?
,إِلٰهِي إِنَّ جُودَكَ بَسَطَ أَمَلِي,O my God! It is certainly Your benevolence that has given me hope.
,وَشُكْرَكَ قَبِلَ عَمَلِي,It is my thanks to You that have granted approval for my deeds.
,سَيِّدِي إِلَيْكَ رَغْبَتِي,"O my Master, for You do I desire,"
,وَإِلَيْكَ رَهْبَتِي,"You do I fear,"
,وَإِلَيْكَ تَأْمِيلِي,and to You do I look forward.
,وَقَدْ سَاقَنِي إِلَيْكَ أَمَلِي,It is my hope that has driven me towards You.
,وَعَلَيْكَ يَا وَاحِدِي عَكَفَتْ هِمَّتِي,"To You, O my One and Only God, do I direct my determination."
,وَفِيمَا عِنْدَكَ ٱنْبَسَطَتْ رَغْبَتِي,Towards what You have in possession are my desires directed.
,وَلَكَ خَالِصُ رَجَائِي وَخَوْفِي,For You is the ultimate of my hope and fear.
,وَبِكَ أَنِسَتْ مَحَبَّتِي,With You have I become familiar.
,وَإِلَيْكَ أَلْقَيْتُ بِيَدِي,To You have I submitted my hand.
,وَبِحَبْلِ طَاعَتِكَ مَدَدْتُ رَهْبَتِي,To the rope of obedience to You have I extended my fears.
,يَا مَوْلايَ بِذِكْرِكَ عَاشَ قَلْبِي,"O my Master, only through mentioning You have my heart lived."
,وَبِمُنَاجَاتِكَ بَرَّدْتُ أَلَمَ ٱلْخَوْفِ عَنِّي,Only through my confidential conversations with You have I cooled the pains of my fear.
,فَيَا مَوْلايَ وَيَا مُؤَمَّلِي وَيَا مُنْتَهَىٰ سُؤْلِي,"So, O my Master! O my Trusty Patron! O Ultimate Hope!"
,فَرِّقْ بَيْنِي وَبَيْنَ ذَنْبِيَ ٱلْمَانِعِ لِي مِنْ لُزُومِ طَاعَتِكَ,Separate me from my transgressions which prevent me from adhering to the obedience to You.
,فَإِنَّمَا أَسْأَلُكَ لِقَدِيمِ ٱلرَّجَاءِ فِيكَ,I only pray You on account of my eternal faith in You
,وَعَظِيمِ ٱلطَّمَعِ مِنْكَ,and my desire for Your mercy and kindness
,ٱلَّذِي أَوْجَبْتَهُ عَلَىٰ نَفْسِكَ مِنَ ٱلرَّأْفَةِ وَٱلرَّحْمَةِ,that You have made incumbent upon Yourself.
,فَٱلأَمْرُ لَكَ وَحْدَكَ لاَ شَرِيكَ لَكَ,"So, the whole affair is Yours alone. There is no partner with You at all."
,وَٱلْخَلْقُ كُلُّهُمْ عِيَالُكَ وَفِي قَبْضَتِكَ,All the creatures are dependent upon You and are in Your grip.
,وَكُلُّ شَيْءٍ خَاضِعٌ لَكَ,All things are submissive to You.
,تَبَارَكْتَ يَا رَبَّ ٱلْعَالَمِينَ,"Blessed be You, O Lord of the worlds."
,إِلٰهِي ٱرْحَمْنِي إِذَا ٱنْقَطَعَتْ حُجَّتِي,"O my God, have mercy on me when my argument is proven nil,"
,وَكَلَّ عَنْ جَوَابِكَ لِسَانِي,"when my tongue can no longer find any answer,"
,وَطَاشَ عِنْدَ سُؤَالِكَ إِيَّايَ لُبِّي,and when my mind scatters as soon as You start interrogating me.
,فَيَا عَظِيمَ رَجَائِي لاَ تُخَيِّبْنِي إِذَا ٱشْتَدَّتْ فَاقَتِي,"So, O my great hope, do not forsake me when my need terribly increases,"
,وَلاَ تَرُدَّنِي لِجَهْلِي,"do not reject me on account of my ignorance,"
,وَلاَ تَمْنَعْنِي لِقِلَّةِ صَبْرِي,and do not stop conferring upon me on account of my lack of patience.
,أَعْطِنِي لِفَقْرِي,Grant me for I am poor.
,وَٱرْحَمْنِي لِضَعْفِي,Have mercy upon me for I am weak.
,سَيِّدِي عَلَيْكَ مُعْتَمَدِي وَمُعَوَّلِي,"O my Master, on You do I rely and lean."
,وَرَجَائِي وَتَوَكُّلِي,"You are my hope, and in You do I have faith."
,وَبِرَحْمَتِكَ تَعَلُّقِي,To Your mercy do I attach myself.
,وَبِفِنَائِكَ أَحُطُّ رَحْلِي,In Your courtyard do I dwell.
,وَبِجُودِكَ أَقْصِدُ طَلِبَتِي,On account of Your benevolence do I declare my request.
,وَبِكَرَمِكَ أَيْ رَبِّ أَسْتَفْتِحُ دُعَائِي,"With Your generosity, O my Lord, do I begin my prayers."
,وَلَدَيْكَ أَرْجُو فَاقَتِي,With You do I desire for meeting my needs.
,وَبِغِنَاكَ أَجْبُرُ عَيْلَتِي,Through Your wealth do I settle my poverty.
,وَتَحْتَ ظِلِّ عَفْوِكَ قِيَامِي,Under the shade of Your pardon do I stand.
,وَإِلَىٰ جُودِكَ وَكَرَمِكَ أَرْفَعُ بَصَرِي,Towards Your benevolence and generosity do I raise my sight.
,وَإِلَىٰ مَعْرُوفِكَ أُدِيمُ نَظَرِي,I persistently look for Your favors;
,فَلاَ تُحْرِقْنِي بِٱلنَّارِ وَأَنْتَ مَوْضِعُ أَمَلِي,"so, do not let the flames of the Fire consume me while You are my ultimate hope,"
,وَلاَ تُسْكِنِّي ٱلْهَاوِيَةَ فَإِنَّكَ قُرَّةُ عَيْنِي,and do not embed me in the deep black abyss while You are the delight of my eyes.
,يَا سَيِّدِي لاَ تُكَذِّبْ ظَنِّي بِإِحْسَانِكَ وَمَعْرُوفِكَ,"O my Master, do not thwart my idea about Your grace and favors,"
,فَإِنَّكَ ثِقَتِي,for in You I trust.
,وَلاَ تَحْرِمْنِي ثَوَابَكَ,"Do not deprive me of Your rewards,"
,فَإِنَّكَ ٱلْعَارِفُ بِفَقْرِي,for You best know my poverty.
,إِلٰهِي إِنْ كَانَ قَدْ دَنَا أَجَلِي وَلَمْ يُقَرِّبْنِي مِنْكَ عَمَلِي,"O my God, if my death is drawing near while my deeds have not yet drawn me near You,"
,فَقَدْ جَعَلْتُ ٱلإِعْتِرَافَ إِلَيْكَ بِذَنْبِي وَسَائِلَ عِلَلِي,then let my confession of having committed sins be my means of justification.
,إِلٰهِي إِنْ عَفَوْتَ فَمَنْ أَوْلَىٰ مِنْكَ بِٱلْعَفْوِ,"O my God, if You forgive, then who is worthier than You in forgiveness?"
,وَإِنْ عَذَّبْتَ فَمَنْ أَعْدَلُ مِنْكَ فِي ٱلْحُكْمِ,"And if You punish, then who is fairer than You in judgment?"
,ٱرْحَمْ فِي هٰذِهِ ٱلدُّنْيَا غُرْبَتِي,"Have mercy on my misery in this world,"
,وَعِنْدَ ٱلْمَوْتِ كُرْبَتِي,"on my grief at the time of death,"
,وَفِي ٱلْقَبْرِ وَحْدَتِي,"on my loneliness in the grave,"
,وَفِي ٱللَّحْدِ وَحْشَتِي,"on my lonesomeness in the underground hole,"
,وَإِذَا نُشِرْتُ لِلْحِسَابِ بَيْنَ يَدَيْكَ ذُلَّ مَوْقِفِي,and on my humiliating situation when I shall be resurrected for account before You.
,وَٱغْفِرْ لِي مَا خَفِيَ عَلَىٰ ٱلآدَمِيِّينَ مِنْ عَمَلِي,"Forgive my deeds that have been concealed from the other human beings,"
,وَأَدِمْ لِي مَا بِهِ سَتَرْتَنِي,"make permanent for me that on account of which You have covered my faults,"
,وَٱرْحَمْنِي صَرِيعاً عَلَىٰ ٱلْفِرَاشِ تُقَلِّبُنِي أَيْدِي أَحِبَّتِي,"have mercy on me when I am thrown on the death bed turned over at the hands of my dear ones,"
,وَتَفَضَّلْ عَلَيَّ مَمْدُوداً عَلَىٰ ٱلْمُغْتَسَلِ يُقَلِّبُنِي صَالِحُ جِيرَتِي,"do a favor to me when I am laid on the table of the dead bathroom turned over at the hands of my righteous neighbors,"
,وَتَحَنَّنْ عَلَيَّ مَحْمُولاً قَدْ تَنَاوَلَ ٱلأَقْرِبَاءُ أَطْرَافَ جِنَازَتِي,"act kindly towards me when I am carried while my relatives hold the edges of my coffin,"
,وَجُدْ عَلَيَّ مَنْقُولاً قَدْ نَزَلْتُ بِكَ وَحِيداً فِي حُفْرَتِي,"be generous with me when I am carried, alone, to my hole,"
,وَٱرْحَمْ فِي ذٰلِكَ ٱلْبَيْتِ ٱلْجَدِيدِ غُرْبَتِي حَتَّىٰ لاَ أَسْتَأْنِسَ بِغَيْرِكَ,have mercy on my loneliness in that (new) dwelling so that I will not feel at ease with anyone other than You.
,يَا سَيِّدِي إِنْ وَكَلْتَنِي إِلَىٰ نَفْسِي هَلَكْتُ,"O my Master, if You leave me for myself, I will certainly perish."
,سَيِّدِي فَبِمَنْ أَسْتَغِيثُ إِنْ لَمْ تُقِلْنِي عَثْرَتِي,"O my Master, to whom will I resort if You do not overlook my slips?"
,فَإِلَىٰ مَنْ أَفْزَعُ إِنْ فَقَدْتُ عِنَايَتَكَ فِي ضَجْعَتِي,To whom will I run for help if I miss Your care for me in my stay (in grave)?
,وَإِلَىٰ مَنْ أَلْتَجِئُ إِنْ لَمْ تُنَفِّسْ كُرْبَتِي,To whom will I refer if You do not relieve my grief?
,سَيِّدِي مَنْ لِي,O my Master! Who will be with me?
,وَمَنْ يَرْحَمُنِي إِنْ لَمْ تَرْحَمْنِي,Who will have mercy on me if You do not?
,وَفَضْلَ مَنْ أُؤَمِّلُ إِنْ عَدِمْتُ فَضْلَكَ يَوْمَ فَاقَتِي,Whose favor will I expect if I miss Your favors on the day of my neediness?
,وَإِلَىٰ مَنِ ٱلْفِرَارُ مِنَ ٱلذُّنُوبِ إِذَا ٱنْقَضَىٰ أَجَلِي,To whom will I flee from my sins when my deadline comes?
,سَيِّدِي لاَ تُعَذِّبْنِي وَأَنَا أَرْجُوكَ,"O my Master, do not punish me while I please You hopefully."
,إِلٰهِي حَقِّقْ رَجَائِي,"O my God, (please do) give success to my expectations"
,وَآمِنْ خَوْفِي,and dispel my fear.
,فَإِنَّ كَثْرَةَ ذُنُوبِي لاَ أَرْجُو فِيهَا إِلاَّ عَفْوَكَ,"As for my numerous sins, I hope for nothing other than Your pardon."
,سَيِّدِي أَنَا أَسْأَلُكَ مَا لاَ أَسْتَحِقُّ,"O my Master, I am asking You for things that I do not deserve"
,وَأَنْتَ أَهْلُ ٱلتَّقْوَىٰ وَأَهْلُ ٱلْمَغْفِرَةِ,and You are verily the worthiest of being feared and the worthiest of forgiving.
,فَٱغْفِرْ لِي وَأَلْبِسْنِي مِنْ نَظَرِكَ ثَوْباً يُغَطِّي عَلَيَّ ٱلتَّبِعَاتِ,"So, forgive me and dress me, out of Your relief, a garment covering all my defects,"
,وَتَغْفِرُهَا لِي وَلاَ أُطَالَبُ بِهَا,and forgive them for me so that I will not be responsible for them.
,إِنَّكَ ذُو مَنٍّ قَدِيمٍ,"Verily, You are the Lord of eternal favoring,"
,وَصَفْحٍ عَظِيمٍ,"great pardon,"
,وَتَجَاوُزٍ كَرِيمٍ,and liberal exoneration.
,إِلٰهِي أَنْتَ ٱلَّذِي تُفِيضُ سَيْبَكَ عَلَىٰ مَنْ لاَ يَسْأَلُكَ,"O my God, You make Your flowing graces reach those who never pray You"
,وَعَلَىٰ ٱلْجَاحِدِينَ بِرُبُوْبِيَّتِكَ,and those who deny Your Lordship.
,فَكَيْفَ سَيِّدِي بِمَنْ سَأَلَكَ وَأَيْقَنَ أَنَّ ٱلْخَلْقَ لَكَ وَٱلأَمْرَ إِلَيْكَ,"So, O my Master, what should You do to those who pray You and believe undoubtedly that You manage all creation and all affairs!"
,تَبَارَكْتَ وَتَعَالَيْتَ يَا رَبَّ ٱلْعَالَمِينَ,"Blessed by You and Exalted be You, O Lord of the worlds!"
,سَيِّدِي عَبْدُكَ بِبَابِكَ أَقَامَتْهُ ٱلْخَصَاصَةُ بَيْنَ يَدَيْكَ,"O my Master, I, Your servant, am standing at Your door owing to neediness,"
,يَقْرَعُ بَابَ إِحْسَانِكَ بِدُعَائِهِ,am knocking at it suppliantly.
,فَلاَ تُعْرِضْ بِوَجْهِكَ ٱلْكَرِيمِ عَنِّي,"So, do not turn Your generous Face away from me."
,وَٱقْبَلْ مِنِّي مَا أَقُولُ فَقَدْ دَعَوْتُ بِهٰذَا ٱلدُّعَاءِ,"Accept that which I utter, for I have prayed using this supplication,"
,وَأَنَا أَرْجُو أَنْ لاَ تَرُدَّنِي مَعْرِفَةً مِنِّي بِرَأْفَتِكَ وَرَحْمَتِكَ,hoping that You will not reject me since I have full awareness of Your kindness and mercifulness.
,إِلٰهِي أَنْتَ ٱلَّذِي لاَ يُحْفِيكَ سَائِلٌ,"O my God, it is You Whom is never disturbed by any suppliant"
,وَلاَ يَنْقُصُكَ نَائِلٌ,and Whose kingdom is never decreased owing to donations.
,أَنْتَ كَمَا تَقُولُ وَفَوْقَ مَا نَقُولُ,You are as exactly as You describe Yourself and is above all that which we say.
,اَللَّهُمَّ إِنِّي أَسْأَلُكَ صَبْراً جَمِيلاً,"O Allah, I beseech You for comely patience,"
,وَفَرَجاً قَرِيباً,"immediate relief,"
,وَقَوْلاً صَادِقاً,"truthful wording,"
,وَأَجْراً عَظِيماً,and splendid reward.
,أَسْأَلُكَ يَا رَبِّ مِنَ ٱلْخَيْرِ كُلِّهِ,"I pray You, O Lord, for all goodness,"
,مَا عَلِمْتُ مِنْهُ وَمَا لَمْ أَعْلَمْ,be it known by me or unknown.
,أَسْأَلُكَ ٱللَّهُمَّ مِنْ خَيْرِ مَا سَأَلَكَ مِنْهُ عِبَادُكَ ٱلصَّالِحُونَ,"I pray You, O Allah, for the goodness that Your righteous servants have besought from You."
,يَا خَيْرَ مَنْ سُئِلَ,O All-excellent One that is asked!
,وَأَجْوَدَ مَنْ أَعْطَىٰ,O most benevolent of those who may give!
,أَعْطِنِي سُؤْلِي فِي نَفْسِي وَأَهْلِي,"(Please do) respond to my request as regards myself, my family,"
,وَوَالِدَيَّ وَوُلْدِي,"my parents, my children,"
,وَأَهْلِ حُزَانَتِي وَإِخْوَانِي فِيكَ,"my comrades, and my brothers-in-faith."
,وَأَرْغِدْ عَيْشِي,"Bless my living,"
,وَأَظْهِرْ مُرُوَّتِي,"manifest my integrity,"
,وَأَصْلِحْ جَمِيعَ أَحْوَالِي,"set aright all my affairs,"
,وَٱجْعَلْنِي مِمَّنْ أَطَلْتَ عُمْرَهُ,"and include me with those whom You decide to live long,"
,وَحَسَّنْتَ عَمَلَهُ,"whose deeds are righteous,"
,وَأَتْمَمْتَ عَلَيْهِ نِعْمَتَكَ وَرَضِيتَ عَنْهُ,"those for whom You have perfected Your favors, those with whom You are pleased,"
,وَأَحْيَيْتَهُ حَيَاةً طَيِّبَةً فِي أَدْوَمِ ٱلسُّرُورِ,"and those whom You have granted comfortable life with permanent pleasure,"
,وَأَسْبَغِ ٱلْكَرَامَةِ وَأَتَمِّ ٱلْعَيْشِ,"reputable honor, and perfect contentment."
,إِنَّكَ تَفْعَلُ مَا تَشَاءُ,"Verily, You do whatever You will,"
,وَلاَ يَفْعَلُ مَا يَشَاءُ غَيْرُكَ,while none else can ever do what one wills.
,اَللَّهُمَّ خُصَّنِي مِنْكَ بِخَاصَّةِ ذِكْرِكَ,"O Allah, give me exclusively the grace of private mention of You,"
,وَلاَ تَجْعَلْ شَيْئاً مِمَّا أَتَقَرَّبُ بِهِ,do not let any of the things by which I seek Your nearness
,فِي آنَاءِ ٱللَّيْلِ وَأَطْرَافِ ٱلنَّهَارِ,in the hours of the night and the ends of the days
,رِيَاءً وَلاَ سُمْعَةً,"take the form of ostentation, showing off,"
,وَلاَ أَشَراً وَلاَ بَطَراً,"pretension, or insolence."
,وَٱجْعَلْنِي لَكَ مِنَ ٱلْخَاشِعِينَ,Include me with the humble ones.
,اَللَّهُمَّ أَعْطِنِي ٱلسَّعَةَ فِي ٱلرِّزْقِ,"O Allah, grant me affluent means of livelihood,"
,وَٱلأَمْنَ فِي ٱلْوَطَنِ,"security in my homeland,"
,وَقُرَّةَ ٱلْعَيْنِ فِي ٱلأَهْلِ وَٱلْمَالِ وَٱلْوَلَدِ,"delight in my family, property, and children,"
,وَٱلْمُقَامَ فِي نِعَمِكَ عِنْدِي,"permanence of Your graces,"
,وَٱلصِّحَّةَ فِي ٱلْجِسْمِ,"healthy body,"
,وَٱلْقُوَّةَ فِي ٱلْبَدَنِ,"strong physique,"
,وَٱلسَّلاَمَةَ فِي ٱلدِّينِ,and sound faith.
,وَٱسْتَعْمِلْنِي بِطَاعَتِكَ وَطَاعَةِ رَسُولِكَ,"Dedicate my affairs to the obedience to You and to Your Messenger,"
,مُحَمَّدٍ صَلَّىٰ ٱللَّهُ عَلَيْهِ وَعَلَىٰ آلِهِ أَبَداً مَا ٱسْتَعْمَرْتَنِي,Muhammad—Allah’s blessings be upon him and his Household—as long as You give me life.
,وَٱجْعَلْنِي مِنْ أَوْفَرِ عِبَادِكَ عِنْدَكَ نَصِيباً,Make me one of the most rewarded servants of You
,فِي كُلِّ خَيْرٍ أَنْزَلْتَهُ وَتُنْزِلُهُ فِي شَهْرِ رَمَضَانَ,in each and every item of goodness that You have descended and You will descend during the month of Ramadan
,فِي لَيْلَةِ ٱلْقَدْرِ,and at the Destiny Night
,وَمَا أَنْتَ مُنْزِلُهُ فِي كُلِّ سَنَةٍ مِنْ رَحْمَةٍ تَنْشُرُهَا,"as well as all that which You decide to descend throughout the year, including mercy that You spread,"
,وَعَافِيَةٍ تُلْبِسُهَا,"good health with which You adorn,"
,وَبَلِيَّةٍ تَدْفَعُهَا,"misfortune that You repel,"
,وَحَسَنَاتٍ تَتَقَبَّلُهَا,"good deeds that You admit,"
,وَسَيِّئَاتٍ تَتَجَاوَزُ عَنْهَا,and evildoings that You excuse.
,وَٱرْزُقْنِي حَجَّ بَيْتِكَ ٱلْحَرَامِ فِي عَامِنَا هٰذَا وَفِي كُلِّ عَامٍ,"Bestow upon me with pilgrimage to Your Holy House in this year plus all years,"
,وَٱرْزُقْنِي رِزْقاً وَاسِعاً مِنْ فَضْلِكَ ٱلْوَاسِعِ,"grant me prosperous sustenance out of Your limitless bounty,"
,وَٱصْرِفْ عَنِّي يَا سَيِّدِي ٱلأَسْوَاءَ,"dismiss, O my Master, all evils from me,"
,وَٱقْضِ عَنِّي ٱلدَّيْنَ وَٱلظًُّلاَمَاتِ حَتَّىٰ لاَ أَتَأَذَّىٰ بِشَيْءٍ مِنْهُ,"help me settle my debts as well as my evildoings so that I will be saved from their liabilities,"
,وَخُذْ عَنِّي بِأَسْمَاعِ وَأَبْصَارِ أَعْدَائِي وَحُسَّادِي وَٱلْبَاغِينَ عَلَيَّ,"save me from the hearings and sights of my enemies, those who envy me, and those who intend to oppress me,"
,وَٱنْصُرْنِي عَلَيْهِمْ,"back me against them,"
,وَأَقِرَّ عَيْنِي وَفَرِّحْ قَلْبِي,"give delight to my eye and joy to my heart,"
,وَٱجْعَلْ لِي مِنْ هَمِّي وَكَرْبِي فَرَجاً وَمَخْرَجاً,"grant me relief and exit against my grief and misery,"
,وَٱجْعَلْ مَنْ أَرَادَنِي بِسُوءٍ مِنْ جَمِيعِ خَلْقِكَ تَحْتَ قَدَمَيَّ,"make all those who intend evil to me, among all Your creatures, be under my feet,"
,وَٱكْفِنِي شَرَّ ٱلشَّيْطَانِ,"protect me against the evil of Satan,"
,وَشَرَّ ٱلسُّلْطَانِ,"the evil of the ruling authority,"
,وَسَيِّئَاتِ عَمَلِي,"and the consequences of my evildoings,"
,وَطَهِّرْنِي مِنَ ٱلذُّنُوبِ كُلِّهَا,"purify me from all my sins,"
