,وَأَجِرْنِي مِنَ ٱلنَّارِ بِعَفْوِكَ,"save me from Hellfire on account of Your pardon,"
,وَأَدْخِلْنِي ٱلْجَنَّةَ بِرَحْمَتِكَ,"allow me to enter Paradise on account of Your mercy,"
,وَزَوِّجْنِي مِنَ ٱلْحُورِ ٱلْعِينِ بِفَضْلِكَ,"marry me off the Paradisiacal women on account of Your grace,"
,وَأَلْحِقْنِي بِأَوْلِيَائِكَ ٱلصَّالِحِينَ مُحَمَّدٍ وَآلِهِ,"and join me to Your righteous intimate servants—Muhammad and his Household,"
,ٱلأَبْرَارِ ٱلطَّيِّبِينَ ٱلطَّاهِرِينَ ٱلأَخْيَارِ,"the purified, the immaculate, and the pious."
,صَلَوَاتُكَ عَلَيْهِمْ وَعَلَىٰ أَجْسَادِهِمْ وَأَرْوَاحِهِمْ وَرَحْمَةُ ٱللَّهِ وَبَرَكَاتُهُ,"May Your peace, mercy, and blessings be upon their bodies and souls."
,إِلٰهِي وَسَيِّدِي وَعِزَّتِكَ وَجَلالِكَ,"O my God and my Master, I swear by Your Mighty and Your Glory,"
,لَئِنْ طَالَبْتَنِي بِذُنُوبِي لَأُطَالِبَنَّكَ بِعَفْوِكَ,"if You will interrogate me for my sins, I will demand with Your pardon."
,وَلَئِنْ طَالَبْتَنِي بِلُؤْمِي لَأُطَالِبَنَّكَ بِكَرَمِكَ,"If You interrogate me for my meanness, I will demand with Your kindness."
,وَلَئِنْ أَدْخَلْتَنِي ٱلنَّارَ َلأُخْبِرَنَّ أَهْلَ ٱلنَّارِ بِحُبِّي لَكَ,"If You order me to Hellfire, I will tell all the inhabitants therein that I love You."
,إِلٰهِي وَسَيِّدِي إِنْ كُنْتَ لاَ تَغْفِرُ إِلاَّ لأَوْلِيَائِكَ وَأَهْلِ طَاعَتِكَ,"O my God and Master, if you forgive only Your intimate servants and those who obey You,"
,فَإِلَىٰ مَنْ يَفْزَعُ ٱلْمُذْنِبُونَ,to whom then will the sinful resort?
,وَإِنْ كُنْتَ لاَ تُكْرِمُ إِلاَّ أَهْلَ ٱلْوَفَاءِ بِكَ,"If You honor none but those who act loyally to You,"
,فَبِمَنْ يَسْتَغِيثُ ٱلْمُسِيئُونَ,then whose shelter will the evildoers seek?
,إِلٰهِي إِنْ أَدْخَلْتَنِي ٱلنَّارَ فَفِي ذٰلِكَ سُرُورُ عَدُوِّكَ,"O my God, if You decide to put me in Hellfire, this will definitely please Your enemies!"
,وَإِنْ أَدْخَلْتَنِي ٱلْجَنَّةَ فَفِي ذٰلِكَ سُرُورُ نَبِيِّكَ,"But if You decide Paradise for me, then this will certainly please Your Prophet!"
,وَأَنَا وَٱللَّهِ أَعْلَمُ أَنَّ سُرُورَ نَبِيِّكَ أَحَبُّ إِلَيْكَ مِنْ سُرُورِ عَدُوِّكَ,And I—by Allah I swear it—know for sure that the pleasure of Your Prophet is more favorable for You than the pleasure of Your enemies.
,اَللَّهُمَّ إِنِّي أَسْأَلُكَ أَنْ تَمْلأَ قَلْبِي حُبّاً لَكَ,"O Allah, I pray You for filling my heart with love for You,"
,وَخَشْيَةً مِنْكَ,"with fear of You,"
,وَتَصْدِيقاً بِكِتَابِكَ,"with belief in Your Book,"
,وَإِيـمَاناً بِكَ,"with faith in You,"
,وَفَرَقاً مِنْكَ,"with dread from You,"
,وَشَوْقاً إِلَيْكَ,and with eagerness to You.
,يَا ذَا ٱلْجَلالِ وَٱلإِكْرَامِ حَبِّبْ إِلَيَّ لِقَاءَكَ,"O Lord of Glory and Honor, (please do) make me love meeting You,"
,وَأَحْبِبْ لِقَائِي,"(please do) love my meeting,"
,وَٱجْعَلْ لِي فِي لِقَائِكَ ٱلرَّاحَةَ وَٱلْفَرَجَ وَٱلْكَرَامَةَ,"and make my meeting You entail comfort, relief, and honoring."
,اَللَّهُمَّ أَلْحِقْنِي بِصَالِحِ مَنْ مَضَىٰ,"O Allah, join me with the righteous ones among the past generations,"
,وَٱجْعَلْنِي مِنْ صَالِحِ مَنْ بَقِيَ وَخُذْ بِي سَبِيلَ ٱلصَّالِحِينَ,"include me with the righteous ones of this generation, guide me to the path of the righteous ones,"
,وَأَعِنِّي عَلَىٰ نَفْسِي بِمَا تُعِينُ بِهِ ٱلصَّالِحِينَ عَلَىٰ أَنْفُسِهِمْ,"help me against myself in just as You help the righteous ones control themselves,"
,وَٱخْتِمْ عَمَلِي بِأَحْسَنِهِ,"seal my deed with the best of it,"
,وَٱجْعَلْ ثَوَابِي مِنْهُ ٱلْجَنَّةَ بِرَحْمَتِكَ,"decide Paradise as the reward of my deeds on account of Your mercy,"
,وَأَعِنِّي عَلَىٰ صَالِحِ مَا أَعْطَيْتَنِي,"help me manage the good things that You have endowed upon me,"
,وَثَبِّتْنِي يَا رَبِّ وَلاَ تَرُدَّنِي فِي سُوءٍ ٱسْتَنْقَذْتَنِي مِنْهُ,"make me firm, O Lord, and do not make me return to evildoing after You have saved me from it."
,يَا رَبَّ ٱلْعَالَمِينَ,O Lord of the worlds!
,اَللَّهُمَّ إِنِّي أَسْأَلُكَ إِيـمَاناً لاَ أَجَلَ لَهُ دُونَ لِقَائِكَ,"O Allah, I beseech You for faith that does not stop until I meet You."
,أَحْيِنِي مَا أَحْيَيْتَنِي عَلَيْهِ,"As long as You grant me lifetime, (please do) connect me to that faith,"
,وَتَوَفَّنِي إِذَا تَوَفَّيْتَنِي عَلَيْهِ,"and when You decide to grasp my soul, make me carry that faith with me."
,وَٱبْعَثْنِي إِذَا بَعَثْتَنِي عَلَيْهِ,"When You resurrect me, make me carry it with me."
,وَأَبْرِئْ قَلْبِي مِنَ ٱلرِّيَاءِ وَٱلشَّكِّ وَٱلسُّمْعَةِ فِي دِينِكَ,"Release my heart from showing off, suspicion, and pretension in the affairs of Your religion"
,حَتَّىٰ يَكُونَ عَمَلِي خَالِصاً لَكَ,so that my deed will be purely intended for Your sake.
,اَللَّهُمَّ أَعْطِنِي بَصِيرَةً فِي دِينِكَ,"O Allah, grant me discerning awareness in Your religion,"
,وَفَهْماً فِي حُكْمِكَ,"understanding of Your laws,"
,وَفِقْهاً فِي عِلْمِكَ,"insight in Your knowledge,"
,وَكِفْلَيْنِ مِنْ رَحْمَتِكَ,"two folds of Your mercy,"
,وَوَرَعاً يَحْجُزُنِي عَنْ مَعَاصِيكَ,and piety that impedes me from disobeying You.
,وَبَيِّضْ وَجْهِي بِنُورِكَ,"Make my face glitter on account of Your light,"
,وَٱجْعَلْ رَغْبَتِي فِيمَا عِنْدَكَ,"make me desire for nothing but that which You hold,"
,وَتَوَفَّنِي فِي سَبِيلِكَ وَعَلَىٰ مِلَّةِ رَسُولِكَ,"and when I die, make me die following Your Path and carrying the principles of Your Prophet—"
,صَلَّىٰ ٱللَّهُ عَلَيْهِ وَعَلَىٰ آلِهِ,Allah’s blessings be upon him and his Household.
,اَللَّهُمَّ إِنِّي أَعُوذُ بِكَ مِنَ ٱلْكَسَلِ وَٱلْفَشَلِ,"O Allah, I seek Your protection against laziness, failure,"
,وَٱلْهَمِّ وَٱلْجُبْنِ وَٱلْبُخْلِ,"grief, cowardice, stinginess,"
,وَٱلْغَفْلَةِ وَٱلْقَسْوَةِ وَٱلْمَسْكَنَةِ,"inattentiveness, brutality, poverty,"
,وَٱلْفَقْرِ وَٱلْفَاقَةِ,"neediness, destitution,"
,وَكُلِّ بَلِيَّةٍ وَٱلْفَوَاحِشِ مَا ظَهَرَ مِنْهَا وَمَا بَطَنَ,"and against all misfortunes and all shameful deeds, whether open or secret."
,وَأَعُوذُ بِكَ مِنْ نَفْسٍ لاَ تَقْنَعُ,"I seek Your protection against having unsatisfied self,"
,وَبَطْنٍ لاَ يَشْبَعُ,"insatiate stomach,"
,وَقَلْبٍ لاَ يَخْشَعُ,"fearless heart,"
,وَدُعَاءٍ لاَ يُسْمَعُ,"unanswered prayers,"
,وَعَمَلٍ لاَ يَنْفَعُ,and futile deed.
,وَأَعُوذُ بِكَ يَا رَبِّ عَلَىٰ نَفْسِي وَدِينِي وَمَالِي,"I ask You, O Lord, to guard myself, my religion, my properties,"
,وَعَلَىٰ جَمِيعِ مَا رَزَقْتَنِي مِنَ ٱلشَّيْطَانِ ٱلرَّجِيمِ,and all that which You have granted me against Satan the accursed.
,إِنَّكَ أَنْتَ ٱلسَّمِيعُ ٱلْعَلِيمُ,"Verily, You are the All-hearing, the All-knowing."
,اَللَّهُمَّ إِنَّهُ لاَ يُجِيرُنِي مِنْكَ أَحَدٌ,"O Allah, none can ever save me against You"
,وَلاَ أَجِدُ مِنْ دُونِكَ مُلْتَحَداً,and I can never find any shelter against You.
,فَلاَ تَجْعَلْ نَفْسِي فِي شَيْءٍ مِنْ عَذَابِكَ,"So, (please) do not make anything that brings about Your punishment control over me,"
,وَلاَ تَرُدَّنِي بِهَلَكَةٍ,"do not let me lead myself to perdition,"
,وَلاَ تَرُدَّنِي بِعَذَابٍ أَلِيمٍ,and do not make me deserve the painful chastisement.
,اَللَّهُمَّ تَقَبَّلْ مِنِّي,"O Allah, accept from me,"
,وَأَعْلِ ذِكْرِي,"grant me reputation,"
,وَٱرْفَعْ دَرَجَتِي,"elevate my rank,"
,وَحُطَّ وِزْرِي,"exonerate my offenses,"
,وَلاَ تَذْكُرْنِي بِخَطِيئَتِي,"do not refer to me with my faults,"
,وَٱجْعَلْ ثَوَابَ مَجْلِسِي,"let the reward of my sessions,"
,وَثَوَابَ مَنْطِقِي,"my utterance,"
,وَثَوَابَ دُعَائِي رِضَاكَ وَٱلْجَنَّةَ,and my prayer be Your pleasure and Paradise.
,وَأَعْطِنِي يَا رَبِّ جَمِيعَ مَا سَأَلْتُكَ وَزِدْنِي مِنْ فَضْلِكَ,"Give me, O Lord, all that which I have asked for from You and grant me more favor,"
,إِنِّي إِلَيْكَ رَاغِبٌ يَا رَبَّ ٱلْعَالَمِينَ,"for I seek none but You, O Lord of the worlds!"
,اَللَّهُمَّ إِنَّكَ أَنْزَلْتَ فِي كِتَابِكَ أَنْ نَعْفُوَ عَمَّنْ ظَلَمَنَا,"O Allah, You have ordered us in Your book that we should overlook those who wrong us."
,وَقَدْ ظَلَمْنَا أَنْفُسَنَا فَٱعْفُ عَنَّا فَإِنَّكَ أَوْلَىٰ بِذٰلِكَ مِنَّا,"We have thus wronged ourselves; so, forgive us, for You are worthier of forgiveness than we are."
,وَأَمَرْتَنَا أَنْ لاَ نَرُدَّ سَائِلاً عَنْ أَبْوَابِنَا,You have ordered us not to reject any beggar being on our doors.
,وَقَدْ جِئْتُكَ سَائِلاً فَلاَ تَرُدَّنِي إِلاَّ بِقَضَاءِ حَاجَتِي,"Here I am begging You; so, do not reject me; rather, respond to my need."
,وَأَمَرْتَنَا بِٱلإِحْسَانِ إِلَىٰ مَا مَلَكَتْ أَيْمَانُنَا,You have ordered us to act nicely to those under our authorities.
,وَنَحْنُ أَرِقَّاؤُكَ فَأَعْتِقْ رِقَابَنَا مِنَ ٱلنَّارِ,"We are surely under Your authority; so, release us from Hellfire."
,يَا مَفْزَعِي عِنْدَ كُرْبَتِي,O my Shelter whenever I am aggrieved!
,وَيَا غَوْثِي عِنْدَ شِدَّتِي,O my Aid whenever hardships hit me!
,إِلَيْكَ فَزِعْتُ,To You have I resorted.
,وَبِكَ ٱسْتَغَثْتُ وَلُذْتُ,With You have I sought refuge and haven.
,لاَ أَلُوذُ بِسِوَاكَ,To none save You shall I ever resort.
,وَلاَ أَطْلُبُ ٱلْفَرَجَ إِلاَّ مِنْكَ,From none save You shall I ever seek for relief.
,فَأَغِثْنِي وَفَرِّجْ عَنِّي,"So, (please do) aid me and relieve my hardship."
,يَا مَنْ يَقْبَلُ ٱلْيَسِيرَ وَيَعْفُو عَنِ ٱلْكَثِيرِ,O He Who accepts the little (deed) and overlooks the much (wrong)!
,ٱقْبَلْ مِنِّيَ ٱلْيَسِيرَ وَٱعْفُ عَنِّيَ ٱلْكَثِيرَ,Accept my little (deed) and overlook my much (wrong).
,إِنَّكَ أَنْتَ ٱلرَّحِيمُ ٱلْغَفُورُ,"You are certainly the All-merciful, the All-forgiving."
,اَللَّهُمَّ إِنِّي أَسْأَلُكَ إِيـمَاناً تُبَاشِرُ بِهِ قَلْبِي,"O Allah, I pray You for faith that covers my heart"
,وَيَقِيناً صَادِقاً حَتَّىٰ أَعْلَمَ أَنَّهُ لَنْ يُصِيبَنِي إِلاَّ مَا كَتَبْتَ لِي,and for honest conviction so that I will believe that nothing will inflict me save that about which You have already known.
,وَرَضِّنِي مِنَ ٱلْعَيْشِ بِمَا قَسَمْتَ لِي,Make me be satisfied with my livelihood that You have decided for me.
,يَا أَرْحَمَ ٱلرَّاحِمِينَ,O most Merciful of all those who show mercy!
,اَللَّهُمَّ صَلِّ عَلَى مُحَمَّدٍ وَ آلِ مُحَمَّد,O Allah bless Muhammad and the family of Muhammad.
