line id verse number,arabic text,english translation text
,,Aoudho Bijalali Wajhikal Kareem
,بِسْمِ اللَّهِ الرَّحْمَنِ الرَّحِيمِ,"In the Name of Allah, the All-merciful, the All-compassionate"
,اَللَّهُمَّ صَلِّ عَلَى مُحَمَّدٍ وَ آلِ مُحَمَّد,O Allah bless Muhammad and the family of Muhammad.
,أَعُوذُ بِجَلالِ وَجْهِكَ الكَرِيمِ,I seek the protection of the Majesty of Your Honorable Face
,أَنْ يَنْقَضِيَ عَنّي شَهْرُ رَمَضَانَ,against that the month of Ramadhan elapses
,أَوْ يَطْلُعَ الفَجْرُ مِنْ لَيْلَتِي هذِهِ,Or dawn puts an end to this night
,وَلَكَ قِبَلِي تَبِعَةٌ أَوْ ذَنْبٌ تُعَذّبُنِي عَلَيْهِ.,but there is still an offense or a sin for which I am still liable and for which You will punish me.
