line id verse number,arabic text,english translation text
,,Dua Tawbah
,َللَّهُمَّ صَلِّ عَلَى مُحَمَّدٍ وَ آلِ مُحَمَّد,O Allah bless Muhammad and the family of Muhammad.
,بِسْمِ اللَّهِ الرَّحْمَنِ الرَّحِيمِ,"In the Name of Allah, the All-merciful, the All-compassionate"
,أَللَّهُمَّ يَا مَنْ لا يَصِفُهُ نَعْتُ الْوَاصِفِينَ،,"O God, O He whom the depiction of the describers fails to describe!"
,وَيَا مَنْ لاَ يُجَاوِزُهُ رَجَاءُ الرَّاجِينَ،,O He beyond whom passes not the hope of the hopers!
,وَيَا مَنْ لاَ يَضِيعُ لَدَيْهِ أَجْرُ الْمُحْسِنِينَ،,O He with whom is not lost the wage of the good-doers!
,وَيَا مَنْ هُوَ مُنْتَهَى خَوْفِ الْعَابِدِيْنَ،,O He who is the ultimate object of the fear of the worshipers!
,وَيَا مَنْ هُوَ غَايَةُ خَشْيَةِ الْمُتَّقِينَ,O He who is the utmost limit of the dread of the god fearing!
,هَذا مَقَامُ مَنْ تَدَاوَلَتْهُ أَيْدِي الذُّنُوبِ،,This is the station of him whom sins have passed from hand to hand.
,وَقَادَتْهُ أَزِمَّةُ الْخَطَايَا،,"Offenses' reins have led him on,"
,وَاسْتَحْوَذَ عَلَيْهِ الشَّيْطَانُ،,and Satan has gained mastery over him.
,فَقَصَّرَ عَمَّا أَمَرْتَ بِهِ تَفْرِيطَاً،,He fell short of what You have commanded through neglect
,وَتَعَاطى مَا نَهَيْتَ عَنْهُ تَغْرِيراً،,"and he pursued what You have prohibited in delusion,"
,كَالْجاهِلِ بِقُدْرَتِكَ عَلَيْهِ،,like one ignorant of Thy power over him
,أَوْ كَالْمُنْكِرِ فَضْلَ إحْسَانِكَ إلَيْهِ،,"or one who denies the bounty of Thy beneficence toward him,"
,حَتَّى إذَا انْفَتَحَ لَهُ بَصَرُ الْهُدَى،,"until, when the eye of guidance was opened for him"
,وَتَقَشَّعَتْ عَنْهُ سَحَائِبُ الْعَمَى أَحْصَى مَا ظَلَمَ بِهِ نَفْسَهُ،,"and the clouds of blindness were dispelled, he reckoned that through which he had wronged himself"
,وَفَكَّرَ فِيمَا خَالَفَ بِهِ رَبَّهُ،,and reflected upon that in which he had opposed his Lord.
,فَرَأى كَبِيْرَ عِصْيَانِهِ كَبِيْراً، وَجَلِيل مُخالفَتِهِ جَلِيْلاً،,He saw his vast disobedience as vast and his great opposition as great.
,فَأَقْبَلَ نَحْوَكَ مُؤَمِّلاً لَكَ، مُسْتَحْيِيَاً مِنْكَ،,"So turned to You, hoping in You and ashamed before You,"
,وَوَجَّهَ رَغْبَتَهُ إلَيْكَ ثِقَةً بِكَ،,"and he directed his beseeching toward You, having trust in You."
,فَأَمَّكَ بِطَمَعِهِ يَقِيناً، وَقَصَدَكَ بِخَوْفِهِ إخْلاَصَاً،,He repaired to You in his longing with certitude and he went straight to You in fear with sincerity.
,قَدْ خَلاَ طَمَعُهُ مِنْ كُلِّ مَطْمُوع فِيهِ غَيْرِكَ،,"His longing was devoid of every object of longing but You,"
,وَأَفْرَخَ رَوْعُهُ مِنْ كُلِّ مَحْذُور مِنْهُ سِوَاكَ،,and his fright departed from every object of fear but You.
,فَمَثَّلَ بَيْنَ يَدَيْـكَ مُتَضَرِّعـاً،,"So he stood before You pleading,"
,وَغَمَّضَ بَصَرَهُ إلَى الأرْضِ مُتَخَشِّعَاً،,"his eyes turned toward the ground in humbleness,"
,وَطَأطَأَ رَأسَهُ لِعِزَّتِكَ مُتَذَلِّلاً،,his head bowed before Thy might in lowliness;
,وَأَبَثَّكَ مِنْ سِرِّهِ مَا أَنْتَ أَعْلَمُ بِهِ مِنْهُ خَضُوعاً،,he revealed to You in meekness those secrets of his which You know better than he;
,وَعَدَّدَ مِنْ ذُنُوبِهِ مَا أَنْتَ أَحْصَى لَهَا خُشُوعاً,he numbered for You in humility those sins of his which You count better than he;
,وَاسْتَغَاثَ بِكَ مِنْ عَظِيمِ مَاوَقَعَ بِهِ فِي عِلْمِكَ,he sought help from You before the dreadful into which he has fallen in Thy knowledge
,وَقَبِيحِ مَا فَضَحَهُ فِي حُكْمِكَ,and the ugly which has disgraced him in Thy judgement:
,مِنْ ذُنُوب أدْبَرَتْ لَذَّاتُهَا فَذَهَبَتْ،,the sins whose pleasures have turned their backs and gone
,وَأَقَامَتْ تَبِعَاتُهَا فَلَزِمَتْ،,and whose evil consequences have stayed and stuck fast.
,لا يُنْكِرُ يَا إلهِي عَدْلَكَ إنْ عَاقَبْتَهُ،,"He will not deny Thy justice, my God, if You punish him,"
,وَلا يَسْتَعْظِمُ عَفْوَكَ إنْ عَفَوْتَ عَنْهُ وَرَحِمْتَهُ,"nor will he consider Thy pardon great if You pardon him and have mercy upon him,"
,لأِنَّكَ الرَّبُّ الْكَرِيمُ,for You art the Generous Lord
,الَّذِي لا يَتَعَاظَمُهُ غُفْرَانُ الذَّنْبِ الْعَظِيم,for whom the forgiveness of great sins is nothing great!
,أَللَّهُمَّ فَهَا أَنَا ذَا قَدْ جئْتُكَ مُطِيعاً,"O God, so here I am: I have come to You obeying Thy command"
,لاِمْرِكَ فِيمَا أَمَرْتَ بِهِ مِنَ الدُّعَاءِ،,(for You have commanded supplication)
,مَتَنَجِّزاً وَعْدَكَ فِيمَا وَعَدْتَ بِهِ مِنَ الإجَابَةِ إذْ تَقُولُ,"and asking the fulfilment of Thy promise, (for You have promised to respond):"
,(اُدْعُونِي أَسْتَجِبْ لَكُمْ),"You have said, ""Supplicate Me and I will respond to you"" (40:60)."
,أللَّهُمَّ فَصَلِّ عَلَى مُحَمَّد وَآلِهِ,"O God, so bless Muhammad and his Household,"
,وَالْقَنِي بِمَغْفِـرَتِكَ كَمَا لَقِيتُكَ بِإقْرَارِي,"meet me with Thy forgiveness just as I have met You with my confession,"
,وَارْفَعْنِي عَنْ مَصَارعِ الذُّنُوبِ كَمَا وَضَعْتُ لَكَ نَفْسِي,"lift me up from the fatal infirmities of sins just as I have let myself down before You,"
,وَاسْتُرْنِي بِسِتْرِكَ كَمَا تَأَنَّيْتَنِي عَنِ الانْتِقَامِ مِنِّي,and cover me with Thy covering just as You have shown no haste to take vengeance on me!
,أللَّهُمَّ وَثَبِّتْ فِي طَاعَتِكَ نِيَّتِيْ،,"O God, make firm my intention to obey You,"
,وَأَحْكِمْ فِي عِبَادَتِكَ بَصِيـرَتِي،,"strengthen my insight in worshipping You,"
,وَوَفِّقْنِي مِنَ الأَعْمَالِ,give me the success of works
,لِمَا تَغْسِلُ بِهِ دَنَسَ الخَطَايَا عَنِّي،,"which will wash away the defilement of offenses,"
,وَتَوَفَّنِي عَلَى مِلَّتِكَ وَمِلَّةِ نَبِيِّكَ,and take me when You take me in the creed of Thy prophet
,مُحَمَّد عَلَيْهِ السَّـلامُ إذَا تَوَفَّيْتَنِي,Muhammad (upon him be peace).
,أللَّهُمَّ إنِّي أَتُوبُ إلَيْـكَ فِي مَقَامِي هَذَا,"O God, I repent to You in this my station from"
,مِنْ كَبَائِرِ ذُنُوبِي وَصَغَائِرِهَا,"my sins, great and small,"
,وَبَوَاطِنِ سَيِّئآتِي وَظَوَاهِرِهَا،,"my evil deeds, inward and outward,"
,وَسَوالِفِ زَلاَّتِي وَحَوَادِثِهَا،,"my lapses, past and recent,"
,تَوْبَةَ مَنْ لا يُحَدِّثُ نَفْسَهُ بِمَعْصِيَةٍ,with the repentance of one who does not tell himself that he might disobey
,وَلاَ يُضْمِرُ أَنْ يَعُودَ فِي خَطِيئَةٍ،,or secretly think that he might return to an offense.
,وَقَدْ قُلْتَ يَا إلهِي فِي مُحْكَمِ كِتابِكَ,"You have said, my God, in the firm text of Thy Book,"
,إنَّكَ تَقْبَلُ التَّوْبَةَ عَنْ عِبَادِكَ،,"that You “accept repentance from Thy servants,"
,وَتَعْفُو عَنِ السَّيِّئاتِ، وَتُحِبُّ التَّوَّابِينَ،,"pardon evil deeds” (ref.42:25), and love those who repent (ref.2:222),"
,فَاقْبَلْ تَوْبَتِي كَمَا وَعَدْتَ وَأعْفُ عَنْ سَيِّئاتِي كَمَا ضَمِنْتَ،,"so accept my repentance as You have promised, pardon my evil deeds as You have guaranteed,"
,وَأَوْجِبْ لِي مَحَبَّتَكَ كَمَا شَـرَطْتَ،,and make obligatory toward me Thy love as You have stipulated!
,وَلَـكَ يَـا رَبِّ شَـرْطِي أَلاّ أَعُودَ فِي مَكْرُوهِكَ،,"To You, my Lord, belongs my stipulation that I will not return to what is disliked by You,"
,وَضَمَانِي أَلاّ أَرْجِعَ فِي مَذْمُومِكَ،,"my guarantee that I will not go back to what You blame,"
,وَعَهْدِي أَنْ أَهْجُرَ جَمِيعَ مَعَاصِيكَ,and my covenant that I will stay away from acts of disobedience to You.
,أللَّهُمَّ إنَّكَ أَعْلَمُ بِمَا عَمِلْتُ فَاغْفِرْ لِي مَا عَلِمْتَ،,"O God, You know better what I have done, so forgive me what You know"
,وَاصْرِفْنِي بِقُدْرَتِكَ إلَى مَا أَحْبَبْتَ,and turn me through Thy power to what You love!
,أللَّهُمَّ وَعَلَيَّ تَبِعَاتٌ قَدْ حَفِظْتُهُنَّ،,"O God, counted against me are claims that stay in my memory"
,وَتَبِعَاتٌ قَدْ نَسيتُهُنَّ،,"and claims that I have forgotten,"
,وَكُلُّهُنَّ بِعَيْنِكَ الَّتِي لاَ تَنَـامُ،,while all of them remain in Thy eye that does not sleep
,وَعِلْمِكَ الَّذِي لا يَنْسَى,and Thy knowledge that does not forget!
,فَعَوِّضْ مِنْهَا أَهْلَهَا وَاحْطُطْ عَنّي وِزْرَهَا،,"So compensate their owners, lighten their load upon me,"
,وَخَفِّفْ عَنِّي ثِقْلَهَا، وَاعْصِمْنِي مِنْ أَنْ اُقَارِفَ مِثْلَهَا,"lift up their weight from me, and preserve me from approaching their like!"
,أللَّهُمَّ وَإنَّهُ لاَ وَفَاءَ لِي بِالتَّوْبَةِ إلاَّ بِعِصْمَتِكَ،,"O God, but I can not be faithful to my repentance without Thy preservation,"
,وَلا اسْتِمْسَاكَ بِي عَنِ الْخَطَايَا إلاَّ عَنْ قُوَّتِكَ،,nor can I refrain from offenses without Thy strength.
,فَقَوِّنِي بِقُوَّة كَافِيَة، وَتَوَلَّنِي بِعِصْمَة مَانِعَة,So strengthen me with a sufficient strength and attend to me with a defending preservation!
,أللَّهُمَّ أَيُّما عَبْد تَابَ إلَيْكَ,"O God, if any servant repents to You,"
,وَهُوَ فِي عِلْمِ الْغَيْبِ عِنْدَكَ فَاسِخٌ لِتَوْبَتِهِ,while in Thy knowledge of the Unseen he will break his repentance
,وَعَائِدٌ فِي ذَنْبِهِ وَخَطِيئَتِهِ,"and return to his sin and offense,"
,فَإنِّي أَعُوذُ بِكَ أنْ أَكُوْنَ كَذلِكَ،,I seek refuge in You lest I be like that!
,فَاجْعَلْ تَوْبَتِي هَذِهِ تَوْبَةً لا أَحْتَاجُ بَعْدَهَا إلَى تَوْبَة،,So make this my repentance a repentance after which I will need no repentance
,تَوْبَةً مُوجِبَةً لِمَحْوِ مَا سَلَفَ، وَالسَّلاَمَةِ فِيمَـا بَقِيَ,and a repentance which will obligate the erasing of what has gone by and safety in what remains!
,أللَّهُمَّ إنِّي أَعْتَـذِرُ إلَيْـكَ مِنْ جَهْلِي،,"O God, I ask pardon from You for my ignorance,"
,وَأَسْتَـوْهِبُـكَ سُوْءَ فِعْلِي،,and I ask You to disregard my evil acts!
,فَـاضْمُمْنِي إلَى كَنَفِ رَحْمَتِكَ تَطَوُّلاً،,So join me to the shelter of Thy mercy through graciousness
,وَاسْتُرْنِي بِسِتْرِ عَافِيَتِكَ تَفَضُّلاً,and cover me with the covering of Thy well-being through bounteousness!
,أللَّهُمَّ وَإنِّي أَتُوبُ إلَيْكَ,"O God, I repent to You"
,مِنْ كُلِّ مَا خَالَفَ إرَادَتَكَ,from everything opposed to Thy will
,أَوْ زَالَ عَنْ مَحَبَّتِـكَ,or far from Thy love -
,مِنْ خَـطَرَاتِ قَلْبِي,"the thoughts of my heart,"
,وَلَحَـظَاتِ عَيْنِي,"the glances of my eye,"
,وَحِكَايَاتِ لِسَانِي،,the tales of my tongue -
,تَوْبَةً تَسْلَمُ بِهَا كُلُّ جَارِحَة عَلَى حِيَالِهَا مِنْ تَبِعَاتِكَ،,with a repentance through which each bodily part will by itself stay safe from ill consequences with You
,وَتَأْمَنُ مِمَّا يَخَافُ الْمُعْتَدُونَ مِنْ أَلِيْمِ سَطَوَاتِكَ,and remain secure from Thy painful penalties feared by transgressors!
,أَللَّهُمَّ فَارْحَمْ وَحْدَتِي بَيْنَ يَدَيْكَ،,"O God, so have mercy on my being alone before You,"
,وَوَجِيبَ قَلْبِي مِنْ خَشْيَتِكَ،,"the pounding of my heart in dread of You,"
,وَاضْطِرَابَ أَرْكَانِي مِنْ هَيْبَتِكَ،,the trembling of my limbs in awe of You!
,فَقَدْ أَقَامَتْنِي يَا رَبِّ ذُنُوبِي مَقَامَ الْخِزْيِ بِفِنَائِكَ،,"My sins, my God, have stood me in the station of degradation in Thy courtyard."
,فَإنْ سَكَتُّ لَمْ يَنْطِقْ عَنِّي أَحَدٌ،,"If I remain silent, none will speak for me;"
,وَإنْ شَفَعْتُ فَلَسْتُ بِأَهْلِ الشَّفَاعَةِ,"if I seek an intercessor, I am not worthy for intercession."
,أَللَّهُمَّ صَلِّ عَلَى مُحَمَّد وَآلِهِ,"O God, bless Muhammad and his Household,"
,وَشَفِّعْ فِي خَطَايَـايَ كَرَمَكَ،,"make Thy generosity intercede for my offenses,"
,وَعُدْ عَلَى سَيِّئاتِي بِعَفْوِكَ،,"follow up my evil deeds with Thy pardon,"
,وَلاَ تَجْزِنِي جَزَآئِي مِنْ عُقُوبَتِكَ,"repay me not with the punishment that is my proper repayment,"
,وَابْسُطْ عَلَيَّ طَوْلَكَ وَجَلِّلْنِي بِسِتْرِكَ،,"spread over me Thy graciousness, wrap me in Thy covering,"
,وَافْعَلْ بِي فِعْلَ عَزِيز تَضَرَّع إلَيْهِ عَبْدٌ ذَلِيلٌ فَرَحِمَهُ،,"and do with me what is done by a mighty man, when a lowly slave pleads to him and he shows him mercy,"
,أَوْ غَنِيٍّ تَعَرَّضَ لَهُ عَبْدٌ فَقِيرٌ فَنَعَشَهُ,"or a rich man, when a poor slave submits himself and he raises him to wealth!"
,أللَّهُمَّ لاَ خَفِيرَ لِي مِنْكَ فَلْيَخْفُرْنِيْ عِزُّكَ،,"O God, I have no protector against You, so let Thy might be my protector!"
,وَلا شَفِيعَ لِيْ إلَيْكَ فَلْيَشْفَعْ لِي فَضْلُكَ،,"I have no intercessor with You, so let Thy bounty be my intercessor!"
,وَقَدْ أَوْجَلَتْنِي خَطَايَايَ فَلْيُؤْمِنِّي عَفْوُكَ،,"My offenses have set me quaking, so let Thy pardon give me security!"
,فَمَا كُلُّ مَا نَطَقْتُ بِهِ عَنْ جَهْل مِنِّي بِسُوْءِ أَثَرِي،,Not all that I have said rises up from my ignorance of my evil footsteps
,وَلاَ نِسيَان لِمَا سَبَقَ مِنْ ذَمِيمِ فِعْلِي،,"or forgetfulness of my blameworthy acts in the past,"
,وَلكِنْ لِتَسْمَعَ سَمَاؤُكَ وَمَنْ فِيْهَـا،,but in order that Thy heaven and those within it
,وَأَرْضُكَ وَمَنْ عَلَيْهَا مَا أَظْهَرْتُ لَكَ مِنَ النَّدَمِ،,and Thy earth and those upon it may hear the remorse which I have professed to You
,وَلَجَـأتُ إلَيْكَ فِيـهِ مِنَ التَّوْبَـةِ،,and the repentance through which I have sought asylum with You.
,فَلَعَـلَّ بَعْضَهُمْ بِرَحْمَتِكَ يَرْحَمُنِي لِسُوءِ مَوْقِفِي،,"Then perhaps one of them, through Thy mercy, may show mercy upon my evil situation"
,أَوْ تُدْرِكُهُ الرِّقَّةُ عَلَىَّ لِسُوءِ حَالِي,or be seized by tenderness for my evil state.
,فَيَنَالَنِي مِنْهُ بِدَعْوَةٍ أَسْمَعُ لَدَيْكَ مِنْ دُعَائِي،,There may come from him for my sake a supplication to which You listen more than to my supplication
,أَوْ شَفَاعَـةٍ أَوْكَدُ عِنْدَكَ مِنْ شَفَاعَتِي,or an intercession surer with You than my intercession
,تَكُونُ بِهَا نَجَاتِي مِنْ غَضَبِكَ وَفَوْزَتِي بِرضَاكَ,through which I may be delivered from Thy wrath and attain to Thy good pleasure!
,أللَّهُمَّ إنْ يَكُنِ النَّدَمُ تَوْبَةً إلَيْكَ فَأَنَا أَنْدَمُ اْلنَّادِمِينَ،,"O God, if remorse is a repentance toward You, then I am the most remorseful of the remorseful!"
,وَإنْ يَكُنِ التَّرْكُ لِمَعْصِيَتِكَ إنَابَةً فَأَنَا أَوَّلُ الْمُنِيبينَ،,"If refraining from disobedience is a turning back to You, then I am the first of those who turn back!"
,وَإنْ يَكُنِ الاسْتِغْفَارُ حِطَّةً لِلذُّنُوبِ فَإنَي لَكَ مِنَ الْمُسْتَغْفِرِينَ,"If praying for forgiveness alleviates sins, surely I am one of those who pray for Thy forgiveness!"
,اللَّهُمَّ فَكَمَا أَمَرْتَ بِالتَّوْبَةِ وَضَمِنْتَ الْقَبُولَ,"O God, as You have commanded repentance and guaranteed acceptance,"
,وَحَثَثْتَ عَلَى الدُّعَـاءِ وَوَعَدْتَ الإجَابَةَ،,"as You have urged supplication, and promised to respond,"
,فَصَلِّ عَلَى مُحَمَّدِ وَآلِهِ وَاقْبَلْ تَوْبَتِي,"so also bless Muhammad and his Household, accept my repentance,"
,وَلاَ تَرْجِعْني مَرجَعَ الخَيبَةِ منْ رَحْمَتِك,and return me not to the returning place of disappointment in Thy mercy!
,إنَّكَ أَنْتَ التَّوَّابُ عَلَى الْمُذْنِبِينَ،,"Surely You art ""Ever-turning"" (2:128) toward the sinners,"
,وَالرَّحِيمُ لِلْخَاطِئِينَ الْمُنِيبِينَ,"""All-compassionate"" (2:128) toward the offenders who turn back!"
,أللَّهُمَّ صَلِّ عَلَى مُحَمَّد وَآلِهِ كَمَا هَدَيْتَنَا بِهِ,"O God, bless Muhammad and his Household just as You have guided us by him!"
,وَصَلِّ عَلَى مُحَمَّد وَآلِهِ كَمَا اسْتَنْقَذْتَنَا بِهِ،,Bless Muhammad and his Household just as You have rescued us through him!
,وَصَلِّ عَلَى مُحَمَّد وَآلِهِ,"Bless Muhammad and his Household,"
,صَلاَةً تَشْفَعُ لَنَا يَوْمَ الْقِيَامَةِ وَيَوْمَ الْفَاقَةِ إلَيْكَ،,"with a blessing that will intercede for us on the Day of Resurrection, the day of neediness toward You!"
,إنَّكَ عَلَى كُلِّ شَيْء قَدِيرٌ وَهُوَ عَلَيْكَ يَسِيرٌ,"""You art powerful over everything"" (3:26), and that is easy for You!"
,َللَّهُمَّ صَلِّ عَلَى مُحَمَّدٍ وَ آلِ مُحَمَّد,O Allah bless Muhammad and the family of Muhammad.
